title,authors,abstract,pdf_url,year
Off-Policy Evaluation and Learning for External Validity under a Covariate Shift,N/A,N/A,https://papers.nips.cc/paper_files/paper/2020/file/0084ae4bc24c0795d1e6a4f58444d39b-Paper.pdf,2020
Self-Supervised MultiModal Versatile Networks,N/A,N/A,https://papers.nips.cc/paper_files/paper/2020/file/0060ef47b12160b9198302ebdb144dcf-Paper.pdf,2020
An Unsupervised Information-Theoretic Perceptual Quality Metric,N/A,N/A,https://papers.nips.cc/paper_files/paper/2020/file/00482b9bed15a272730fcb590ffebddd-Paper.pdf,2020
"Benchmarking Deep Inverse Models over time, and the Neural-Adjoint method",N/A,N/A,https://papers.nips.cc/paper_files/paper/2020/file/007ff380ee5ac49ffc34442f5c2a2b86-Paper.pdf,2020
Neural Methods for Point-wise Dependency Estimation,N/A,N/A,https://papers.nips.cc/paper_files/paper/2020/file/00a03ec6533ca7f5c644d198d815329c-Paper.pdf,2020
Fast and Flexible Temporal Point Processes with Triangular Maps,N/A,N/A,https://papers.nips.cc/paper_files/paper/2020/file/00ac8ed3b4327bdd4ebbebcb2ba10a00-Paper.pdf,2020
Backpropagating Linearly Improves Transferability of Adversarial Examples,N/A,N/A,https://papers.nips.cc/paper_files/paper/2020/file/00e26af6ac3b1c1c49d7c3d79c60d000-Paper.pdf,2020
A graph similarity for deep learning,N/A,N/A,https://papers.nips.cc/paper_files/paper/2020/file/0004d0b59e19461ff126e3a08a814c33-Paper.pdf,2020
PyGlove: Symbolic Programming for Automated Machine Learning,N/A,N/A,https://papers.nips.cc/paper_files/paper/2020/file/012a91467f210472fab4e11359bbfef6-Paper.pdf,2020
Improved Algorithms for Online Submodular Maximization via First-order Regret Bounds,N/A,N/A,https://papers.nips.cc/paper_files/paper/2020/file/0163cceb20f5ca7b313419c068abd9dc-Paper.pdf,2020
Adversarially Robust Streaming Algorithms via Differential Privacy,N/A,N/A,https://papers.nips.cc/paper_files/paper/2020/file/0172d289da48c48de8c5ebf3de9f7ee1-Paper.pdf,2020
Synbols: Probing Learning Algorithms with Synthetic Datasets,N/A,N/A,https://papers.nips.cc/paper_files/paper/2020/file/0169cf885f882efd795951253db5cdfb-Paper.pdf,2020
Improving Local Identifiability in Probabilistic Box Embeddings,N/A,N/A,https://papers.nips.cc/paper_files/paper/2020/file/01c9d2c5b3ff5cbba349ec39a570b5e3-Paper.pdf,2020
Cascaded Text Generation with Markov Transformers,N/A,N/A,https://papers.nips.cc/paper_files/paper/2020/file/01a0683665f38d8e5e567b3b15ca98bf-Paper.pdf,2020
Permute-and-Flip: A new mechanism for differentially private selection,N/A,N/A,https://papers.nips.cc/paper_files/paper/2020/file/01e00f2f4bfcbb7505cb641066f2859b-Paper.pdf,2020
Fourier Sparse Leverage Scores and Approximate Kernel Learning,N/A,N/A,https://papers.nips.cc/paper_files/paper/2020/file/012d9fe15b2493f21902cd55603382ec-Paper.pdf,2020
Statistical Guarantees of Distributed Nearest Neighbor Classification,N/A,N/A,https://papers.nips.cc/paper_files/paper/2020/file/022e0ee5162c13d9a7bb3bd00fb032ce-Paper.pdf,2020
Stein Self-Repulsive Dynamics: Benefits From Past Samples,N/A,N/A,https://papers.nips.cc/paper_files/paper/2020/file/023d0a5671efd29e80b4deef8262e297-Paper.pdf,2020
The Statistical Complexity of Early-Stopped Mirror Descent,N/A,N/A,https://papers.nips.cc/paper_files/paper/2020/file/024d2d699e6c1a82c9ba986386f4d824-Paper.pdf,2020
Trading Personalization for Accuracy: Data Debugging in Collaborative Filtering,N/A,N/A,https://papers.nips.cc/paper_files/paper/2020/file/019fa4fdf1c04cf73ba25aa2223769cd-Paper.pdf,2020
Algorithmic recourse under imperfect causal knowledge: a probabilistic approach,N/A,N/A,https://papers.nips.cc/paper_files/paper/2020/file/02a3c7fb3f489288ae6942498498db20-Paper.pdf,2020
A Causal View on Robustness  of Neural Networks,N/A,N/A,https://papers.nips.cc/paper_files/paper/2020/file/02ed812220b0705fabb868ddbf17ea20-Paper.pdf,2020
Minimax Classification with 0-1 Loss and Performance Guarantees,N/A,N/A,https://papers.nips.cc/paper_files/paper/2020/file/02f657d55eaf1c4840ce8d66fcdaf90c-Paper.pdf,2020
How to Learn a Useful Critic? Model-based Action-Gradient-Estimator Policy Optimization,N/A,N/A,https://papers.nips.cc/paper_files/paper/2020/file/03255088ed63354a54e0e5ed957e9008-Paper.pdf,2020
Quantitative Propagation of Chaos for SGD in Wide Neural Networks,N/A,N/A,https://papers.nips.cc/paper_files/paper/2020/file/02e74f10e0327ad868d138f2b4fdd6f0-Paper.pdf,2020
Reciprocal Adversarial Learning via Characteristic Functions,N/A,N/A,https://papers.nips.cc/paper_files/paper/2020/file/021f6dd88a11ca489936ae770e4634ad-Paper.pdf,2020
Coresets for Regressions with Panel Data,N/A,N/A,https://papers.nips.cc/paper_files/paper/2020/file/03287fcce194dbd958c2ec5b33705912-Paper.pdf,2020
Efficient Contextual Bandits with Continuous Actions,N/A,N/A,https://papers.nips.cc/paper_files/paper/2020/file/033cc385728c51d97360020ed57776f0-Paper.pdf,2020
Achieving Equalized Odds by Resampling Sensitive Attributes,N/A,N/A,https://papers.nips.cc/paper_files/paper/2020/file/03593ce517feac573fdaafa6dcedef61-Paper.pdf,2020
Hard Shape-Constrained Kernel Machines,N/A,N/A,https://papers.nips.cc/paper_files/paper/2020/file/03fa2f7502f5f6b9169e67d17cbf51bb-Paper.pdf,2020
Learning Composable Energy Surrogates for PDE Order Reduction,N/A,N/A,https://papers.nips.cc/paper_files/paper/2020/file/0332d694daab22e0e0eaf7a5e88433f9-Paper.pdf,2020
A Closer Look at the Training Strategy for Modern Meta-Learning,N/A,N/A,https://papers.nips.cc/paper_files/paper/2020/file/0415740eaa4d9decbc8da001d3fd805f-Paper.pdf,2020
Generalised Bayesian Filtering via Sequential Monte Carlo,N/A,N/A,https://papers.nips.cc/paper_files/paper/2020/file/04ecb1fa28506ccb6f72b12c0245ddbc-Paper.pdf,2020
On the Value of Out-of-Distribution Testing: An Example of Goodhart's Law,N/A,N/A,https://papers.nips.cc/paper_files/paper/2020/file/045117b0e0a11a242b9765e79cbf113f-Paper.pdf,2020
Multi-Robot Collision Avoidance under Uncertainty with Probabilistic Safety Barrier Certificates,N/A,N/A,https://papers.nips.cc/paper_files/paper/2020/file/03793ef7d06ffd63d34ade9d091f1ced-Paper.pdf,2020
Deterministic Approximation for Submodular Maximization over a Matroid in Nearly Linear Time,N/A,N/A,https://papers.nips.cc/paper_files/paper/2020/file/05128e44e27c36bdba71221bfccf735d-Paper.pdf,2020
Efficient Variational Inference for Sparse Deep Learning with Theoretical Guarantee,N/A,N/A,https://papers.nips.cc/paper_files/paper/2020/file/05a624166c8eb8273b8464e8d9cb5bd9-Paper.pdf,2020
Learning Manifold Implicitly via Explicit Heat-Kernel Learning,N/A,N/A,https://papers.nips.cc/paper_files/paper/2020/file/05e2a0647e260c355dd2b2175edb45b8-Paper.pdf,2020
Simultaneous Preference and Metric Learning from Paired Comparisons,N/A,N/A,https://papers.nips.cc/paper_files/paper/2020/file/0561bc7ecba98e39ca7994f93311ba23-Paper.pdf,2020
Flows for simultaneous manifold learning and density estimation,N/A,N/A,https://papers.nips.cc/paper_files/paper/2020/file/051928341be67dcba03f0e04104d9047-Paper.pdf,2020
Deep Relational Topic Modeling via Graph Poisson Gamma Belief Network,N/A,N/A,https://papers.nips.cc/paper_files/paper/2020/file/05ee45de8d877c3949760a94fa691533-Paper.pdf,2020
One-bit Supervision for Image Classification,N/A,N/A,https://papers.nips.cc/paper_files/paper/2020/file/05f971b5ec196b8c65b75d2ef8267331-Paper.pdf,2020
Submodular Maximization Through Barrier Functions,N/A,N/A,https://papers.nips.cc/paper_files/paper/2020/file/061412e4a03c02f9902576ec55ebbe77-Paper.pdf,2020
What is being transferred in transfer learning?,N/A,N/A,https://papers.nips.cc/paper_files/paper/2020/file/0607f4c705595b911a4f3e7a127b44e0-Paper.pdf,2020
Learning to Extrapolate Knowledge: Transductive Few-shot Out-of-Graph Link Prediction,N/A,N/A,https://papers.nips.cc/paper_files/paper/2020/file/0663a4ddceacb40b095eda264a85f15c-Paper.pdf,2020
Neural Networks with Recurrent Generative Feedback,N/A,N/A,https://papers.nips.cc/paper_files/paper/2020/file/0660895c22f8a14eb039bfb9beb0778f-Paper.pdf,2020
Improving Inference for Neural Image Compression,N/A,N/A,https://papers.nips.cc/paper_files/paper/2020/file/066f182b787111ed4cb65ed437f0855b-Paper.pdf,2020
FixMatch: Simplifying Semi-Supervised Learning with Consistency and Confidence,N/A,N/A,https://papers.nips.cc/paper_files/paper/2020/file/06964dce9addb1c5cb5d6e3d9838f733-Paper.pdf,2020
Exploiting weakly supervised visual patterns to learn from partial annotations,N/A,N/A,https://papers.nips.cc/paper_files/paper/2020/file/066ca7bf90807fcd8e4f1eaef4e4e8f7-Paper.pdf,2020
Neuron Merging: Compensating for Pruned Neurons,N/A,N/A,https://papers.nips.cc/paper_files/paper/2020/file/0678ca2eae02d542cc931e81b74de122-Paper.pdf,2020
Rankmax: An Adaptive Projection Alternative to the Softmax Function,N/A,N/A,https://papers.nips.cc/paper_files/paper/2020/file/070dbb6024b5ef93784428afc71f2146-Paper.pdf,2020
Online Agnostic Boosting via Regret Minimization,N/A,N/A,https://papers.nips.cc/paper_files/paper/2020/file/07168af6cb0ef9f78dae15739dd73255-Paper.pdf,2020
Reinforcement Learning with Combinatorial Actions: An Application to Vehicle Routing,N/A,N/A,https://papers.nips.cc/paper_files/paper/2020/file/06a9d51e04213572ef0720dd27a84792-Paper.pdf,2020
Causal Intervention for Weakly-Supervised Semantic Segmentation,N/A,N/A,https://papers.nips.cc/paper_files/paper/2020/file/07211688a0869d995947a8fb11b215d6-Paper.pdf,2020
Belief Propagation Neural Networks,N/A,N/A,https://papers.nips.cc/paper_files/paper/2020/file/07217414eb3fbe24d4e5b6cafb91ca18-Paper.pdf,2020
Over-parameterized Adversarial Training: An Analysis Overcoming the Curse of Dimensionality,N/A,N/A,https://papers.nips.cc/paper_files/paper/2020/file/0740bb92e583cd2b88ec7c59f985cb41-Paper.pdf,2020
Post-training Iterative Hierarchical Data Augmentation for Deep Networks,N/A,N/A,https://papers.nips.cc/paper_files/paper/2020/file/074177d3eb6371e32c16c55a3b8f706b-Paper.pdf,2020
Towards Playing Full MOBA Games with Deep Reinforcement Learning,N/A,N/A,https://papers.nips.cc/paper_files/paper/2020/file/06d5ae105ea1bea4d800bc96491876e9-Paper.pdf,2020
Fairness without Demographics through Adversarially Reweighted Learning,N/A,N/A,https://papers.nips.cc/paper_files/paper/2020/file/07fc15c9d169ee48573edd749d25945d-Paper.pdf,2020
Stochastic Latent Actor-Critic: Deep Reinforcement Learning with a Latent Variable Model,N/A,N/A,https://papers.nips.cc/paper_files/paper/2020/file/08058bf500242562c0d031ff830ad094-Paper.pdf,2020
Deep reconstruction of strange attractors from time series,N/A,N/A,https://papers.nips.cc/paper_files/paper/2020/file/021bbc7ee20b71134d53e20206bd6feb-Paper.pdf,2020
Robust compressed sensing using generative models,N/A,N/A,https://papers.nips.cc/paper_files/paper/2020/file/07cb5f86508f146774a2fac4373a8e50-Paper.pdf,2020
Ridge Rider: Finding Diverse Solutions by Following Eigenvectors of the Hessian,N/A,N/A,https://papers.nips.cc/paper_files/paper/2020/file/08425b881bcde94a383cd258cea331be-Paper.pdf,2020
Online Algorithm for Unsupervised Sequential Selection with Contextual Information,N/A,N/A,https://papers.nips.cc/paper_files/paper/2020/file/08e5d8066881eab185d0de9db3b36c7f-Paper.pdf,2020
What went wrong and when? Instance-wise feature importance for time-series black-box models,N/A,N/A,https://papers.nips.cc/paper_files/paper/2020/file/08fa43588c2571ade19bc0fa5936e028-Paper.pdf,2020
Adapting Neural Architectures Between Domains,N/A,N/A,https://papers.nips.cc/paper_files/paper/2020/file/08f38e0434442128fab5ead6217ca759-Paper.pdf,2020
Towards Better Generalization of Adaptive Gradient Methods,N/A,N/A,https://papers.nips.cc/paper_files/paper/2020/file/08fb104b0f2f838f3ce2d2b3741a12c2-Paper.pdf,2020
The route to chaos in routing games: When is price of anarchy too optimistic?,N/A,N/A,https://papers.nips.cc/paper_files/paper/2020/file/0887f1a5b9970ad13f46b8c1485f7900-Paper.pdf,2020
Tree! I am no Tree! I am a low dimensional Hyperbolic Embedding,N/A,N/A,https://papers.nips.cc/paper_files/paper/2020/file/093f65e080a295f8076b1c5722a46aa2-Paper.pdf,2020
Deep Structural Causal Models for Tractable Counterfactual Inference,N/A,N/A,https://papers.nips.cc/paper_files/paper/2020/file/0987b8b338d6c90bbedd8631bc499221-Paper.pdf,2020
Learning Guidance Rewards with Trajectory-space Smoothing,N/A,N/A,https://papers.nips.cc/paper_files/paper/2020/file/0912d0f15f1394268c66639e39b26215-Paper.pdf,2020
Variance Reduction via Accelerated Dual Averaging for Finite-Sum Optimization,N/A,N/A,https://papers.nips.cc/paper_files/paper/2020/file/093b60fd0557804c8ba0cbf1453da22f-Paper.pdf,2020
A Statistical Framework for Low-bitwidth Training of Deep Neural Networks,N/A,N/A,https://papers.nips.cc/paper_files/paper/2020/file/099fe6b0b444c23836c4a5d07346082b-Paper.pdf,2020
Better Set Representations For Relational Reasoning,N/A,N/A,https://papers.nips.cc/paper_files/paper/2020/file/09ccf3183d9e90e5ae1f425d5f9b2c00-Paper.pdf,2020
AutoSync: Learning to Synchronize for Data-Parallel Distributed Deep Learning,N/A,N/A,https://papers.nips.cc/paper_files/paper/2020/file/0a2298a72858d90d5c4b4fee954b6896-Paper.pdf,2020
Hardness of Learning Neural Networks with Natural Weights,N/A,N/A,https://papers.nips.cc/paper_files/paper/2020/file/0a4dc6dae338c9cb08947c07581f77a2-Paper.pdf,2020
Higher-Order Spectral Clustering of Directed Graphs,N/A,N/A,https://papers.nips.cc/paper_files/paper/2020/file/0a5052334511e344f15ae0bfafd47a67-Paper.pdf,2020
Primal-Dual Mesh Convolutional Neural Networks,N/A,N/A,https://papers.nips.cc/paper_files/paper/2020/file/0a656cc19f3f5b41530182a9e03982a4-Paper.pdf,2020
The Advantage of Conditional Meta-Learning for Biased Regularization and Fine Tuning,N/A,N/A,https://papers.nips.cc/paper_files/paper/2020/file/0a716fe8c7745e51a3185fc8be6ca23a-Paper.pdf,2020
Sinkhorn Barycenter via Functional Gradient Descent,N/A,N/A,https://papers.nips.cc/paper_files/paper/2020/file/0a93091da5efb0d9d5649e7f6b2ad9d7-Paper.pdf,2020
Watch out! Motion is Blurring the Vision of Your Deep Neural Networks,N/A,N/A,https://papers.nips.cc/paper_files/paper/2020/file/0a73de68f10e15626eb98701ecf03adb-Paper.pdf,2020
Coresets for Near-Convex Functions,N/A,N/A,https://papers.nips.cc/paper_files/paper/2020/file/0afe095e81a6ac76ff3f69975cb3e7ae-Paper.pdf,2020
Bayesian Deep Ensembles via the Neural Tangent Kernel,N/A,N/A,https://papers.nips.cc/paper_files/paper/2020/file/0b1ec366924b26fc98fa7b71a9c249cf-Paper.pdf,2020
Improved Schemes for Episodic Memory-based Lifelong Learning,N/A,N/A,https://papers.nips.cc/paper_files/paper/2020/file/0b5e29aa1acf8bdc5d8935d7036fa4f5-Paper.pdf,2020
A Combinatorial Perspective on Transfer Learning,N/A,N/A,https://papers.nips.cc/paper_files/paper/2020/file/0a3b6f64f0523984e51323fe53b8c504-Paper.pdf,2020
Convolutional Generation of Textured 3D Meshes,N/A,N/A,https://papers.nips.cc/paper_files/paper/2020/file/098d86c982354a96556bd861823ebfbd-Paper.pdf,2020
Taming Discrete Integration via the Boon of Dimensionality,N/A,N/A,https://papers.nips.cc/paper_files/paper/2020/file/0baf163c24ed14b515aaf57a9de5501c-Paper.pdf,2020
Discovering Reinforcement Learning Algorithms,N/A,N/A,https://papers.nips.cc/paper_files/paper/2020/file/0b96d81f0494fde5428c7aea243c9157-Paper.pdf,2020
Adaptive Sampling for Stochastic Risk-Averse Learning,N/A,N/A,https://papers.nips.cc/paper_files/paper/2020/file/0b6ace9e8971cf36f1782aa982a708db-Paper.pdf,2020
Deep Wiener Deconvolution: Wiener Meets Deep Learning for Image Deblurring,N/A,N/A,https://papers.nips.cc/paper_files/paper/2020/file/0b8aff0438617c055eb55f0ba5d226fa-Paper.pdf,2020
Simplify and Robustify Negative Sampling for Implicit Collaborative Filtering,N/A,N/A,https://papers.nips.cc/paper_files/paper/2020/file/0c7119e3a6a2209da6a5b90e5b5b75bd-Paper.pdf,2020
Model Selection for Production System via Automated Online Experiments,N/A,N/A,https://papers.nips.cc/paper_files/paper/2020/file/0c72cb7ee1512f800abe27823a792d03-Paper.pdf,2020
On the Almost Sure Convergence of Stochastic Gradient Descent in Non-Convex Problems,N/A,N/A,https://papers.nips.cc/paper_files/paper/2020/file/0cb5ebb1b34ec343dfe135db691e4a85-Paper.pdf,2020
Automatic Perturbation Analysis for Scalable Certified Robustness and Beyond,N/A,N/A,https://papers.nips.cc/paper_files/paper/2020/file/0cbc5671ae26f67871cb914d81ef8fc1-Paper.pdf,2020
Adaptation Properties Allow Identification of Optimized Neural Codes,N/A,N/A,https://papers.nips.cc/paper_files/paper/2020/file/0cc24cb7c26586310cc95c8cb1a81cbc-Paper.pdf,2020
Global Convergence and Variance Reduction for a Class of Nonconvex-Nonconcave Minimax Problems,N/A,N/A,https://papers.nips.cc/paper_files/paper/2020/file/0cc6928e741d75e7a92396317522069e-Paper.pdf,2020
Online Influence Maximization under Linear Threshold Model,N/A,N/A,https://papers.nips.cc/paper_files/paper/2020/file/0d352b4d3a317e3eae221199fdb49651-Paper.pdf,2020
Model-Based Multi-Agent RL in Zero-Sum Markov Games with Near-Optimal Sample Complexity,N/A,N/A,https://papers.nips.cc/paper_files/paper/2020/file/0cc6ee01c82fc49c28706e0918f57e2d-Paper.pdf,2020
Conservative Q-Learning for Offline Reinforcement Learning,N/A,N/A,https://papers.nips.cc/paper_files/paper/2020/file/0d2b2061826a5df3221116a5085a6052-Paper.pdf,2020
Asymmetric Shapley values: incorporating causal knowledge into model-agnostic explainability,N/A,N/A,https://papers.nips.cc/paper_files/paper/2020/file/0d770c496aa3da6d2c3f2bd19e7b9d6b-Paper.pdf,2020
Blind Video Temporal Consistency via Deep Video Prior,N/A,N/A,https://papers.nips.cc/paper_files/paper/2020/file/0c0a7566915f4f24853fc4192689aa7e-Paper.pdf,2020
Ensembling geophysical models with Bayesian Neural Networks,N/A,N/A,https://papers.nips.cc/paper_files/paper/2020/file/0d5501edb21a59a43435efa67f200828-Paper.pdf,2020
Planning in Markov Decision Processes with Gap-Dependent Sample Complexity,N/A,N/A,https://papers.nips.cc/paper_files/paper/2020/file/0d85eb24e2add96ff1a7021f83c1abc9-Paper.pdf,2020
Provably Good Batch Off-Policy Reinforcement Learning Without Great Exploration,N/A,N/A,https://papers.nips.cc/paper_files/paper/2020/file/0dc23b6a0e4abc39904388dd3ffadcd1-Paper.pdf,2020
Detection as Regression: Certified Object Detection with Median Smoothing,N/A,N/A,https://papers.nips.cc/paper_files/paper/2020/file/0dd1bc593a91620daecf7723d2235624-Paper.pdf,2020
Contextual Reserve Price Optimization in Auctions via Mixed Integer Programming,N/A,N/A,https://papers.nips.cc/paper_files/paper/2020/file/0e1bacf07b14673fcdb553da51b999a5-Paper.pdf,2020
ExpandNets: Linear Over-parameterization to Train Compact Convolutional Networks,N/A,N/A,https://papers.nips.cc/paper_files/paper/2020/file/0e1ebad68af7f0ae4830b7ac92bc3c6f-Paper.pdf,2020
FleXOR: Trainable Fractional Quantization,N/A,N/A,https://papers.nips.cc/paper_files/paper/2020/file/0e230b1a582d76526b7ad7fc62ae937d-Paper.pdf,2020
Understanding Deep Architecture with Reasoning Layer,N/A,N/A,https://papers.nips.cc/paper_files/paper/2020/file/0d82627e10660af39ea7eb69c3568955-Paper.pdf,2020
The Implications of Local Correlation on Learning Some Deep Functions,N/A,N/A,https://papers.nips.cc/paper_files/paper/2020/file/0e4ceef65add6cf21c0f3f9da53b71c0-Paper.pdf,2020
A Game Theoretic Analysis of Additive Adversarial Attacks and Defenses,N/A,N/A,https://papers.nips.cc/paper_files/paper/2020/file/0ea6f098a59fcf2462afc50d130ff034-Paper.pdf,2020
Recurrent Quantum Neural Networks,N/A,N/A,https://papers.nips.cc/paper_files/paper/2020/file/0ec96be397dd6d3cf2fecb4a2d627c1c-Paper.pdf,2020
Posterior Network: Uncertainty Estimation without OOD Samples via Density-Based Pseudo-Counts,N/A,N/A,https://papers.nips.cc/paper_files/paper/2020/file/0eac690d7059a8de4b48e90f14510391-Paper.pdf,2020
Learning to search efficiently for causally near-optimal treatments,N/A,N/A,https://papers.nips.cc/paper_files/paper/2020/file/0e900ad84f63618452210ab8baae0218-Paper.pdf,2020
No-Regret Learning and Mixed Nash Equilibria: They Do Not Mix,N/A,N/A,https://papers.nips.cc/paper_files/paper/2020/file/0ed9422357395a0d4879191c66f4faa2-Paper.pdf,2020
A Unifying View of Optimism in Episodic Reinforcement Learning,N/A,N/A,https://papers.nips.cc/paper_files/paper/2020/file/0f0e13216262f4a201bec128044dd30f-Paper.pdf,2020
Continuous Submodular Maximization: Beyond DR-Submodularity,N/A,N/A,https://papers.nips.cc/paper_files/paper/2020/file/0f34132b15dd02f282a11ea1e322a96d-Paper.pdf,2020
An Asymptotically Optimal Primal-Dual Incremental Algorithm for Contextual Linear Bandits,N/A,N/A,https://papers.nips.cc/paper_files/paper/2020/file/0f34314d2dd0c1b9311cb8f40eb4f255-Paper.pdf,2020
On the Similarity between the Laplace and Neural Tangent Kernels,N/A,N/A,https://papers.nips.cc/paper_files/paper/2020/file/1006ff12c465532f8c574aeaa4461b16-Paper.pdf,2020
Assessing SATNet's Ability to Solve the Symbol Grounding Problem,N/A,N/A,https://papers.nips.cc/paper_files/paper/2020/file/0ff8033cf9437c213ee13937b1c4c455-Paper.pdf,2020
Debugging Tests for Model Explanations,N/A,N/A,https://papers.nips.cc/paper_files/paper/2020/file/075b051ec3d22dac7b33f788da631fd4-Paper.pdf,2020
HiPPO: Recurrent Memory with Optimal Polynomial Projections,N/A,N/A,https://papers.nips.cc/paper_files/paper/2020/file/102f0bb6efb3a6128a3c750dd16729be-Paper.pdf,2020
A causal view of compositional zero-shot recognition,N/A,N/A,https://papers.nips.cc/paper_files/paper/2020/file/1010cedf85f6a7e24b087e63235dc12e-Paper.pdf,2020
CASTLE: Regularization via Auxiliary Causal Graph Discovery,N/A,N/A,https://papers.nips.cc/paper_files/paper/2020/file/1068bceb19323fe72b2b344ccf85c254-Paper.pdf,2020
Auto Learning Attention,N/A,N/A,https://papers.nips.cc/paper_files/paper/2020/file/103303dd56a731e377d01f6a37badae3-Paper.pdf,2020
Long-Tailed Classification by Keeping the Good and Removing the Bad Momentum Causal Effect,N/A,N/A,https://papers.nips.cc/paper_files/paper/2020/file/1091660f3dff84fd648efe31391c5524-Paper.pdf,2020
Explainable Voting,N/A,N/A,https://papers.nips.cc/paper_files/paper/2020/file/10c72a9d42dd07a028ee910f7854da5d-Paper.pdf,2020
Delving into the Cyclic Mechanism in Semi-supervised Video Object Segmentation,N/A,N/A,https://papers.nips.cc/paper_files/paper/2020/file/0d5bd023a3ee11c7abca5b42a93c4866-Paper.pdf,2020
Re-Examining Linear Embeddings for High-Dimensional Bayesian Optimization,N/A,N/A,https://papers.nips.cc/paper_files/paper/2020/file/10fb6cfa4c990d2bad5ddef4f70e8ba2-Paper.pdf,2020
Deep Archimedean Copulas,N/A,N/A,https://papers.nips.cc/paper_files/paper/2020/file/10eb6500bd1e4a3704818012a1593cc3-Paper.pdf,2020
A Bayesian Nonparametrics View into Deep Representations,N/A,N/A,https://papers.nips.cc/paper_files/paper/2020/file/0ffaca95e3e5242ba1097ad8a9a6e95d-Paper.pdf,2020
Neural Networks Fail to Learn Periodic Functions and How to Fix It,N/A,N/A,https://papers.nips.cc/paper_files/paper/2020/file/1160453108d3e537255e9f7b931f4e90-Paper.pdf,2020
Learning to Dispatch for Job Shop Scheduling via Deep Reinforcement Learning,N/A,N/A,https://papers.nips.cc/paper_files/paper/2020/file/11958dfee29b6709f48a9ba0387a2431-Paper.pdf,2020
On Adaptive Attacks to Adversarial Example Defenses,N/A,N/A,https://papers.nips.cc/paper_files/paper/2020/file/11f38f8ecd71867b42433548d1078e38-Paper.pdf,2020
UnModNet: Learning to Unwrap a Modulo Image for High Dynamic Range Imaging,N/A,N/A,https://papers.nips.cc/paper_files/paper/2020/file/1102a326d5f7c9e04fc3c89d0ede88c9-Paper.pdf,2020
Distribution Matching for Crowd Counting,N/A,N/A,https://papers.nips.cc/paper_files/paper/2020/file/118bd558033a1016fcc82560c65cca5f-Paper.pdf,2020
Online Sinkhorn: Optimal Transport distances from sample streams,N/A,N/A,https://papers.nips.cc/paper_files/paper/2020/file/123650dd0560587918b3d771cf0c0171-Paper.pdf,2020
Sinkhorn Natural Gradient for Generative Models,N/A,N/A,https://papers.nips.cc/paper_files/paper/2020/file/122e27d57ae8ecb37f3f1da67abb33cb-Paper.pdf,2020
Thunder: a Fast Coordinate Selection Solver for  Sparse Learning,N/A,N/A,https://papers.nips.cc/paper_files/paper/2020/file/11348e03e23b137d55d94464250a67a2-Paper.pdf,2020
Compositional Generalization via Neural-Symbolic Stack Machines,N/A,N/A,https://papers.nips.cc/paper_files/paper/2020/file/12b1e42dc0746f22cf361267de07073f-Paper.pdf,2020
Unreasonable Effectiveness of Greedy Algorithms in Multi-Armed Bandit with Many Arms,N/A,N/A,https://papers.nips.cc/paper_files/paper/2020/file/12d16adf4a9355513f9d574b76087a08-Paper.pdf,2020
Graphon Neural Networks and the Transferability of Graph Neural Networks,N/A,N/A,https://papers.nips.cc/paper_files/paper/2020/file/12bcd658ef0a540cabc36cdf2b1046fd-Paper.pdf,2020
Ultrahyperbolic Representation Learning,N/A,N/A,https://papers.nips.cc/paper_files/paper/2020/file/123b7f02433572a0a560e620311a469c-Paper.pdf,2020
Deep Transformers with Latent Depth,N/A,N/A,https://papers.nips.cc/paper_files/paper/2020/file/1325cdae3b6f0f91a1b629307bf2d498-Paper.pdf,2020
Locally-Adaptive Nonparametric Online Learning,N/A,N/A,https://papers.nips.cc/paper_files/paper/2020/file/12780ea688a71dabc284b064add459a4-Paper.pdf,2020
A Scalable MIP-based Method for Learning Optimal Multivariate Decision Trees,N/A,N/A,https://papers.nips.cc/paper_files/paper/2020/file/1373b284bc381890049e92d324f56de0-Paper.pdf,2020
Efficient Exact Verification of Binarized Neural Networks,N/A,N/A,https://papers.nips.cc/paper_files/paper/2020/file/1385974ed5904a438616ff7bdb3f7439-Paper.pdf,2020
Correspondence learning via linearly-invariant embedding,N/A,N/A,https://papers.nips.cc/paper_files/paper/2020/file/11953163dd7fb12669b41a48f78a29b6-Paper.pdf,2020
Ultra-Low Precision 4-bit Training of Deep Neural Networks,N/A,N/A,https://papers.nips.cc/paper_files/paper/2020/file/13b919438259814cd5be8cb45877d577-Paper.pdf,2020
Statistical control for spatio-temporal MEG/EEG source imaging with desparsified mutli-task Lasso,N/A,N/A,https://papers.nips.cc/paper_files/paper/2020/file/1359aa933b48b754a2f54adb688bfa77-Paper.pdf,2020
