title,authors,abstract,pdf_url,year
Robust Density Estimation under Besov IPM Losses,N/A,N/A,https://papers.nips.cc/paper_files/paper/2020/file/39d4b545fb02556829aab1db805021c3-Paper.pdf,2020
Sparse Graphical Memory for Robust Planning,N/A,N/A,https://papers.nips.cc/paper_files/paper/2020/file/385822e359afa26d52b5b286226f2cea-Paper.pdf,2020
Enabling certification of verification-agnostic networks via memory-efficient semidefinite programming,N/A,N/A,https://papers.nips.cc/paper_files/paper/2020/file/397d6b4c83c91021fe928a8c4220386b-Paper.pdf,2020
An analytic theory of shallow networks dynamics for hinge loss classification,N/A,N/A,https://papers.nips.cc/paper_files/paper/2020/file/3a01fc0853ebeba94fde4d1cc6fb842a-Paper.pdf,2020
Fixed-Support Wasserstein Barycenters: Computational Hardness and Fast Algorithm,N/A,N/A,https://papers.nips.cc/paper_files/paper/2020/file/3a029f04d76d32e79367c4b3255dda4d-Paper.pdf,2020
Adam with Bandit Sampling for Deep Learning,N/A,N/A,https://papers.nips.cc/paper_files/paper/2020/file/3a077e8acfc4a2b463c47f2125fdfac5-Paper.pdf,2020
Learning to Orient Surfaces by Self-supervised Spherical CNNs,N/A,N/A,https://papers.nips.cc/paper_files/paper/2020/file/3a0772443a0739141292a5429b952fe6-Paper.pdf,2020
Statistical Efficiency of Thompson Sampling for Combinatorial Semi-Bandits,N/A,N/A,https://papers.nips.cc/paper_files/paper/2020/file/3a4496776767aaa99f9804d0905fe584-Paper.pdf,2020
Agnostic Learning of a Single Neuron with Gradient Descent,N/A,N/A,https://papers.nips.cc/paper_files/paper/2020/file/3a37abdeefe1dab1b30f7c5c7e581b93-Paper.pdf,2020
Analytic Characterization of the Hessian in Shallow ReLU Models: A Tale of Symmetry,N/A,N/A,https://papers.nips.cc/paper_files/paper/2020/file/3a61ed715ee66c48bacf237fa7bb5289-Paper.pdf,2020
Parabolic Approximation Line Search for DNNs,N/A,N/A,https://papers.nips.cc/paper_files/paper/2020/file/3a30be93eb45566a90f4e95ee72a089a-Paper.pdf,2020
Sub-sampling for Efficient Non-Parametric Bandit Exploration,N/A,N/A,https://papers.nips.cc/paper_files/paper/2020/file/3ab6be46e1d6b21d59a3c3a0b9d0f6ef-Paper.pdf,2020
Learning under Model Misspecification: Applications to Variational and Ensemble methods,N/A,N/A,https://papers.nips.cc/paper_files/paper/2020/file/3ac48664b7886cf4e4ab4aba7e6b6bc9-Paper.pdf,2020
Towards practical differentially private causal graph discovery,N/A,N/A,https://papers.nips.cc/paper_files/paper/2020/file/3b13b1eb44b05f57735764786fab9c2c-Paper.pdf,2020
Language Through a Prism: A Spectral Approach for Multiscale Language Representations,N/A,N/A,https://papers.nips.cc/paper_files/paper/2020/file/3acb2a202ae4bea8840224e6fce16fd0-Paper.pdf,2020
Independent Policy Gradient Methods for Competitive Reinforcement Learning,N/A,N/A,https://papers.nips.cc/paper_files/paper/2020/file/3b2acfe2e38102074656ed938abf4ac3-Paper.pdf,2020
Generative causal explanations of black-box classifiers,N/A,N/A,https://papers.nips.cc/paper_files/paper/2020/file/3a93a609b97ec0ab0ff5539eb79ef33a-Paper.pdf,2020
DVERGE: Diversifying Vulnerabilities for Enhanced Robust Generation of Ensembles,N/A,N/A,https://papers.nips.cc/paper_files/paper/2020/file/3ad7c2ebb96fcba7cda0cf54a2e802f5-Paper.pdf,2020
The Value Equivalence Principle for Model-Based Reinforcement Learning,N/A,N/A,https://papers.nips.cc/paper_files/paper/2020/file/3bb585ea00014b0e3ebe4c6dd165a358-Paper.pdf,2020
Latent World Models For Intrinsically Motivated Exploration,N/A,N/A,https://papers.nips.cc/paper_files/paper/2020/file/3c09bb10e2189124fdd8f467cc8b55a7-Paper.pdf,2020
Estimating Rank-One Spikes from Heavy-Tailed Noise via Self-Avoiding Walks,N/A,N/A,https://papers.nips.cc/paper_files/paper/2020/file/3c0de3fec9ab8a3df01109251f137119-Paper.pdf,2020
Structured Convolutions for Efficient Neural Network Design,N/A,N/A,https://papers.nips.cc/paper_files/paper/2020/file/3be0214185d6177a9aa6adea5a720b09-Paper.pdf,2020
Learning of Discrete Graphical Models with Neural Networks,N/A,N/A,https://papers.nips.cc/paper_files/paper/2020/file/3cc697419ea18cc98d525999665cb94a-Paper.pdf,2020
Training Generative Adversarial Networks by Solving Ordinary Differential Equations,N/A,N/A,https://papers.nips.cc/paper_files/paper/2020/file/3c8f9a173f749710d6377d3150cf90da-Paper.pdf,2020
Policy Improvement via Imitation of Multiple Oracles,N/A,N/A,https://papers.nips.cc/paper_files/paper/2020/file/3c56fe2f24038c4d22b9eb0aca78f590-Paper.pdf,2020
Entrywise convergence of iterative methods for eigenproblems,N/A,N/A,https://papers.nips.cc/paper_files/paper/2020/file/3d8e03e8b133b16f13a586f0c01b6866-Paper.pdf,2020
RepPoints v2: Verification Meets Regression for Object Detection,N/A,N/A,https://papers.nips.cc/paper_files/paper/2020/file/3ce3bd7d63a2c9c81983cc8e9bd02ae5-Paper.pdf,2020
Gradient Estimation with Stochastic Softmax Tricks,N/A,N/A,https://papers.nips.cc/paper_files/paper/2020/file/3df80af53dce8435cf9ad6c3e7a403fd-Paper.pdf,2020
Self-supervised Co-Training for Video Representation Learning,N/A,N/A,https://papers.nips.cc/paper_files/paper/2020/file/3def184ad8f4755ff269862ea77393dd-Paper.pdf,2020
A Catalyst Framework for Minimax Optimization,N/A,N/A,https://papers.nips.cc/paper_files/paper/2020/file/3db54f5573cd617a0112d35dd1e6b1ef-Paper.pdf,2020
SLIP: Learning to predict in unknown dynamical systems with long-term memory,N/A,N/A,https://papers.nips.cc/paper_files/paper/2020/file/3e91970f771a2c473ae36b60d1146068-Paper.pdf,2020
Meta-Learning Requires Meta-Augmentation,N/A,N/A,https://papers.nips.cc/paper_files/paper/2020/file/3e5190eeb51ebe6c5bbc54ee8950c548-Paper.pdf,2020
Improving GAN Training with Probability Ratio Clipping and Sample Reweighting,N/A,N/A,https://papers.nips.cc/paper_files/paper/2020/file/3eb46aa5d93b7a5939616af91addfa88-Paper.pdf,2020
Bayesian Bits: Unifying Quantization and Pruning,N/A,N/A,https://papers.nips.cc/paper_files/paper/2020/file/3f13cf4ddf6fc50c0d39a1d5aeb57dd8-Paper.pdf,2020
Gaussian Process Bandit Optimization of the Thermodynamic Variational Objective,N/A,N/A,https://papers.nips.cc/paper_files/paper/2020/file/3f2dff7862a70f97a59a1fa02c3ec110-Paper.pdf,2020
On Testing of Samplers,N/A,N/A,https://papers.nips.cc/paper_files/paper/2020/file/3f1656d9668dffcf8119e3ecff873558-Paper.pdf,2020
MiniLM: Deep Self-Attention Distillation for Task-Agnostic Compression of Pre-Trained Transformers,N/A,N/A,https://papers.nips.cc/paper_files/paper/2020/file/3f5ee243547dee91fbd053c1c4a845aa-Paper.pdf,2020
Optimal Epoch Stochastic Gradient Descent Ascent Methods for Min-Max Optimization,N/A,N/A,https://papers.nips.cc/paper_files/paper/2020/file/3f8b2a81da929223ae025fcec26dde0d-Paper.pdf,2020
Graph Contrastive Learning with Augmentations,N/A,N/A,https://papers.nips.cc/paper_files/paper/2020/file/3fe230348e9a12c13120749e3f9fa4cd-Paper.pdf,2020
Gradient Surgery for Multi-Task Learning,N/A,N/A,https://papers.nips.cc/paper_files/paper/2020/file/3fe78a8acf5fda99de95303940a2420c-Paper.pdf,2020
Bayesian Probabilistic Numerical Integration with Tree-Based Models,N/A,N/A,https://papers.nips.cc/paper_files/paper/2020/file/3fe94a002317b5f9259f82690aeea4cd-Paper.pdf,2020
Woodbury Transformations for Deep Generative Flows,N/A,N/A,https://papers.nips.cc/paper_files/paper/2020/file/3fb04953d95a94367bb133f862402bce-Paper.pdf,2020
Graph Meta Learning via Local Subgraphs,N/A,N/A,https://papers.nips.cc/paper_files/paper/2020/file/412604be30f701b1b1e3124c252065e6-Paper.pdf,2020
Stochastic Deep Gaussian Processes over Graphs,N/A,N/A,https://papers.nips.cc/paper_files/paper/2020/file/415e1af7ea95f89f4e375162b21ae38c-Paper.pdf,2020
Bayesian Causal Structural Learning with Zero-Inflated Poisson Bayesian Networks,N/A,N/A,https://papers.nips.cc/paper_files/paper/2020/file/4175a4b46a45813fccf4bd34c779d817-Paper.pdf,2020
Evaluating Attribution for Graph Neural Networks,N/A,N/A,https://papers.nips.cc/paper_files/paper/2020/file/417fbbf2e9d5a28a855a11894b2e795a-Paper.pdf,2020
On Second Order Behaviour in Augmented Neural ODEs,N/A,N/A,https://papers.nips.cc/paper_files/paper/2020/file/418db2ea5d227a9ea8db8e5357ca2084-Paper.pdf,2020
Deep learning versus kernel learning: an empirical study of loss landscape geometry and the time evolution of the Neural Tangent Kernel,N/A,N/A,https://papers.nips.cc/paper_files/paper/2020/file/405075699f065e43581f27d67bb68478-Paper.pdf,2020
Neuron Shapley: Discovering the Responsible Neurons,N/A,N/A,https://papers.nips.cc/paper_files/paper/2020/file/41c542dfe6e4fc3deb251d64cf6ed2e4-Paper.pdf,2020
GPU-Accelerated Primal Learning for Extremely Fast Large-Scale Classification,N/A,N/A,https://papers.nips.cc/paper_files/paper/2020/file/41e7637e7b6a9f27a98b84d3a185c7c0-Paper.pdf,2020
Random Reshuffling is Not Always Better,N/A,N/A,https://papers.nips.cc/paper_files/paper/2020/file/42299f06ee419aa5d9d07798b56779e2-Paper.pdf,2020
Model Agnostic Multilevel Explanations,N/A,N/A,https://papers.nips.cc/paper_files/paper/2020/file/426f990b332ef8193a61cc90516c1245-Paper.pdf,2020
Stochastic Normalizing Flows,N/A,N/A,https://papers.nips.cc/paper_files/paper/2020/file/41d80bfc327ef980528426fc810a6d7a-Paper.pdf,2020
Revisiting Parameter Sharing for Automatic Neural Channel Number Search,N/A,N/A,https://papers.nips.cc/paper_files/paper/2020/file/42cd63cb189c30ed03e42ce2c069566c-Paper.pdf,2020
Differentially-Private Federated Linear Bandits,N/A,N/A,https://papers.nips.cc/paper_files/paper/2020/file/4311359ed4969e8401880e3c1836fbe1-Paper.pdf,2020
Is Plug-in Solver Sample-Efficient for Feature-based Reinforcement Learning?,N/A,N/A,https://papers.nips.cc/paper_files/paper/2020/file/43207fd5e34f87c48d584fc5c11befb8-Paper.pdf,2020
NeuMiss networks: differentiable programming for supervised learning with missing values.,N/A,N/A,https://papers.nips.cc/paper_files/paper/2020/file/42ae1544956fbe6e09242e6cd752444c-Paper.pdf,2020
Deep Graph Pose: a semi-supervised deep graphical model for improved animal pose tracking,N/A,N/A,https://papers.nips.cc/paper_files/paper/2020/file/4379cf00e1a95a97a33dac10ce454ca4-Paper.pdf,2020
Meta-learning from Tasks with Heterogeneous Attribute Spaces,N/A,N/A,https://papers.nips.cc/paper_files/paper/2020/file/438124b4c06f3a5caffab2c07863b617-Paper.pdf,2020
Estimating decision tree learnability with polylogarithmic sample complexity,N/A,N/A,https://papers.nips.cc/paper_files/paper/2020/file/439d8c975f26e5005dcdbf41b0d84161-Paper.pdf,2020
Learning Object-Centric Representations of Multi-Object Scenes from Multiple Views,N/A,N/A,https://papers.nips.cc/paper_files/paper/2020/file/3d9dabe52805a1ea21864b09f3397593-Paper.pdf,2020
Multimodal Generative Learning Utilizing Jensen-Shannon-Divergence,N/A,N/A,https://papers.nips.cc/paper_files/paper/2020/file/43bb733c1b62a5e374c63cb22fa457b4-Paper.pdf,2020
Sparse Symplectically Integrated Neural Networks,N/A,N/A,https://papers.nips.cc/paper_files/paper/2020/file/439fca360bc99c315c5882c4432ae7a4-Paper.pdf,2020
Reinforcement Learning with General Value Function Approximation: Provably Efficient Approach via Bounded Eluder Dimension,N/A,N/A,https://papers.nips.cc/paper_files/paper/2020/file/440924c5948e05070663f88e69e8242b-Paper.pdf,2020
Predicting Training Time Without Training,N/A,N/A,https://papers.nips.cc/paper_files/paper/2020/file/440e7c3eb9bbcd4c33c3535354a51605-Paper.pdf,2020
Solver-in-the-Loop: Learning from Differentiable Physics to Interact with Iterative PDE-Solvers,N/A,N/A,https://papers.nips.cc/paper_files/paper/2020/file/43e4e6a6f341e00671e123714de019a8-Paper.pdf,2020
How does This Interaction Affect Me? Interpretable Attribution for Feature Interactions,N/A,N/A,https://papers.nips.cc/paper_files/paper/2020/file/443dec3062d0286986e21dc0631734c9-Paper.pdf,2020
Continuous Object Representation Networks: Novel View Synthesis without Target View Supervision,N/A,N/A,https://papers.nips.cc/paper_files/paper/2020/file/43a7c24e2d1fe375ce60d84ac901819f-Paper.pdf,2020
Optimal Adaptive Electrode Selection to Maximize Simultaneously Recorded Neuron Yield,N/A,N/A,https://papers.nips.cc/paper_files/paper/2020/file/445e1050156c6ae8c082a8422bb7dfc0-Paper.pdf,2020
Neurosymbolic Reinforcement Learning with Formally Verified Exploration,N/A,N/A,https://papers.nips.cc/paper_files/paper/2020/file/448d5eda79895153938a8431919f4c9f-Paper.pdf,2020
Multi-task Batch Reinforcement Learning with Metric Learning,N/A,N/A,https://papers.nips.cc/paper_files/paper/2020/file/4496bf24afe7fab6f046bf4923da8de6-Paper.pdf,2020
Unfolding the Alternating Optimization for Blind Super Resolution,N/A,N/A,https://papers.nips.cc/paper_files/paper/2020/file/3d2d8ccb37df977cb6d9da15b76c3f3a-Paper.pdf,2020
Learning Physical Graph Representations from Visual Scenes,N/A,N/A,https://papers.nips.cc/paper_files/paper/2020/file/4324e8d0d37b110ee1a4f1633ac52df5-Paper.pdf,2020
Learning Kernel Tests Without Data Splitting,N/A,N/A,https://papers.nips.cc/paper_files/paper/2020/file/44f683a84163b3523afe57c2e008bc8c-Paper.pdf,2020
Boundary thickness and robustness in learning models,N/A,N/A,https://papers.nips.cc/paper_files/paper/2020/file/44e76e99b5e194377e955b13fb12f630-Paper.pdf,2020
Demixed shared component analysis of neural population data from multiple brain areas,N/A,N/A,https://papers.nips.cc/paper_files/paper/2020/file/44ece762ae7e41e3a0b1301488907eaa-Paper.pdf,2020
Minibatch vs Local SGD for Heterogeneous Distributed Learning,N/A,N/A,https://papers.nips.cc/paper_files/paper/2020/file/45713f6ff2041d3fdfae927b82488db8-Paper.pdf,2020
Unsupervised Data Augmentation for Consistency Training,N/A,N/A,https://papers.nips.cc/paper_files/paper/2020/file/44feb0096faa8326192570788b38c1d1-Paper.pdf,2020
Multi-task Causal Learning with Gaussian Processes,N/A,N/A,https://papers.nips.cc/paper_files/paper/2020/file/45c166d697d65080d54501403b433256-Paper.pdf,2020
Subgroup-based Rank-1 Lattice Quasi-Monte Carlo,N/A,N/A,https://papers.nips.cc/paper_files/paper/2020/file/456048afb7253926e1fbb7486e699180-Paper.pdf,2020
Proximity Operator of the Matrix Perspective Function and its Applications,N/A,N/A,https://papers.nips.cc/paper_files/paper/2020/file/45f31d16b1058d586fc3be7207b58053-Paper.pdf,2020
The Power of Comparisons for Actively Learning Linear Classifiers,N/A,N/A,https://papers.nips.cc/paper_files/paper/2020/file/4607f7fff0dce694258e1c637512aa9d-Paper.pdf,2020
On 1/n neural representation and robustness,N/A,N/A,https://papers.nips.cc/paper_files/paper/2020/file/44bf89b63173d40fb39f9842e308b3f9-Paper.pdf,2020
Generative 3D Part Assembly via Dynamic Graph Learning,N/A,N/A,https://papers.nips.cc/paper_files/paper/2020/file/45fbc6d3e05ebd93369ce542e8f2322d-Paper.pdf,2020
Improving Natural Language Processing Tasks with Human Gaze-Guided Neural Attention,N/A,N/A,https://papers.nips.cc/paper_files/paper/2020/file/460191c72f67e90150a093b4585e7eb4-Paper.pdf,2020
From Boltzmann Machines to Neural Networks and Back Again,N/A,N/A,https://papers.nips.cc/paper_files/paper/2020/file/464074179972cbbd75a39abc6954cd12-Paper.pdf,2020
Crush Optimism with Pessimism: Structured Bandits Beyond Asymptotic Optimality,N/A,N/A,https://papers.nips.cc/paper_files/paper/2020/file/46489c17893dfdcf028883202cefd6d1-Paper.pdf,2020
Pruning neural networks without any data by iteratively conserving synaptic flow,N/A,N/A,https://papers.nips.cc/paper_files/paper/2020/file/46a4378f835dc8040c8057beb6a2da52-Paper.pdf,2020
Detecting Interactions from Neural Networks via Topological Analysis,N/A,N/A,https://papers.nips.cc/paper_files/paper/2020/file/473803f0f2ebd77d83ee60daaa61f381-Paper.pdf,2020
Interpretable and Personalized Apprenticeship Scheduling: Learning Interpretable Scheduling Policies from Heterogeneous User Demonstrations,N/A,N/A,https://papers.nips.cc/paper_files/paper/2020/file/477bdb55b231264bb53a7942fd84254d-Paper.pdf,2020
Neural Bridge Sampling for Evaluating Safety-Critical Autonomous Systems,N/A,N/A,https://papers.nips.cc/paper_files/paper/2020/file/475d66314dc56a0df8fb8f7c5dbbaf78-Paper.pdf,2020
Federated Principal Component Analysis,N/A,N/A,https://papers.nips.cc/paper_files/paper/2020/file/47a658229eb2368a99f1d032c8848542-Paper.pdf,2020
(De)Randomized Smoothing for Certifiable Defense against Patch Attacks,N/A,N/A,https://papers.nips.cc/paper_files/paper/2020/file/47ce0875420b2dbacfc5535f94e68433-Paper.pdf,2020
SMYRF - Efficient Attention using Asymmetric Clustering,N/A,N/A,https://papers.nips.cc/paper_files/paper/2020/file/47d40767c7e9df50249ebfd9c7cfff77-Paper.pdf,2020
Task-Agnostic Online Reinforcement Learning with an Infinite Mixture of Gaussian Processes,N/A,N/A,https://papers.nips.cc/paper_files/paper/2020/file/47951a40efc0d2f7da8ff1ecbfde80f4-Paper.pdf,2020
A Simple and Efficient Smoothing Method for Faster Optimization and Local Exploration,N/A,N/A,https://papers.nips.cc/paper_files/paper/2020/file/481d462e46c2ab976294271a175b8929-Paper.pdf,2020
Hyperparameter Ensembles for Robustness and Uncertainty Quantification,N/A,N/A,https://papers.nips.cc/paper_files/paper/2020/file/481fbfa59da2581098e841b7afc122f1-Paper.pdf,2020
Neutralizing Self-Selection Bias in Sampling for Sortition,N/A,N/A,https://papers.nips.cc/paper_files/paper/2020/file/48237d9f2dea8c74c2a72126cf63d933-Paper.pdf,2020
On the Convergence of Smooth Regularized Approximate Value Iteration Schemes,N/A,N/A,https://papers.nips.cc/paper_files/paper/2020/file/483101a6bc4e6c46a86222eb65fbcb6a-Paper.pdf,2020
Benchmarking Deep Learning Interpretability in Time Series Predictions,N/A,N/A,https://papers.nips.cc/paper_files/paper/2020/file/47a3893cc405396a5c30d91320572d6d-Paper.pdf,2020
Off-Policy Evaluation via the Regularized Lagrangian,N/A,N/A,https://papers.nips.cc/paper_files/paper/2020/file/488e4104520c6aab692863cc1dba45af-Paper.pdf,2020
The LoCA Regret: A Consistent Metric to Evaluate Model-Based Behavior in Reinforcement Learning,N/A,N/A,https://papers.nips.cc/paper_files/paper/2020/file/48db71587df6c7c442e5b76cc723169a-Paper.pdf,2020
Towards Scalable Bayesian Learning of Causal DAGs,N/A,N/A,https://papers.nips.cc/paper_files/paper/2020/file/48f7d3043bc03e6c48a6f0ebc0f258a8-Paper.pdf,2020
Neural Power Units,N/A,N/A,https://papers.nips.cc/paper_files/paper/2020/file/48e59000d7dfcf6c1d96ce4a603ed738-Paper.pdf,2020
Bootstrapping neural processes,N/A,N/A,https://papers.nips.cc/paper_files/paper/2020/file/492114f6915a69aa3dd005aa4233ef51-Paper.pdf,2020
Most ReLU Networks Suffer from $\ell^2$ Adversarial Perturbations,N/A,N/A,https://papers.nips.cc/paper_files/paper/2020/file/497476fe61816251905e8baafdf54c23-Paper.pdf,2020
Large-Scale Adversarial Training for Vision-and-Language Representation Learning,N/A,N/A,https://papers.nips.cc/paper_files/paper/2020/file/49562478de4c54fafd4ec46fdb297de5-Paper.pdf,2020
Compositional Visual Generation with Energy Based Models,N/A,N/A,https://papers.nips.cc/paper_files/paper/2020/file/49856ed476ad01fcff881d57e161d73f-Paper.pdf,2020
Factor Graph Grammars,N/A,N/A,https://papers.nips.cc/paper_files/paper/2020/file/49ca03822497d26a3943d5084ed59130-Paper.pdf,2020
Introducing Routing Uncertainty in Capsule Networks,N/A,N/A,https://papers.nips.cc/paper_files/paper/2020/file/47fd3c87f42f55d4b233417d49c34783-Paper.pdf,2020
Erdos Goes Neural: an Unsupervised Learning Framework for Combinatorial Optimization on Graphs,N/A,N/A,https://papers.nips.cc/paper_files/paper/2020/file/49f85a9ed090b20c8bed85a5923c669f-Paper.pdf,2020
Debiasing Distributed Second Order Optimization with Surrogate Sketching and Scaled Regularization,N/A,N/A,https://papers.nips.cc/paper_files/paper/2020/file/4a46fbfca3f1465a27b210f4bdfe6ab3-Paper.pdf,2020
Autoregressive Score Matching,N/A,N/A,https://papers.nips.cc/paper_files/paper/2020/file/4a4526b1ec301744aba9526d78fcb2a6-Paper.pdf,2020
Neural Controlled Differential Equations for Irregular Time Series,N/A,N/A,https://papers.nips.cc/paper_files/paper/2020/file/4a5876b450b45371f6cfe5047ac8cd45-Paper.pdf,2020
On Correctness of Automatic Differentiation for Non-Differentiable Functions,N/A,N/A,https://papers.nips.cc/paper_files/paper/2020/file/4aaa76178f8567e05c8e8295c96171d8-Paper.pdf,2020
On Efficiency in Hierarchical Reinforcement Learning,N/A,N/A,https://papers.nips.cc/paper_files/paper/2020/file/4a5cfa9281924139db466a8a19291aff-Paper.pdf,2020
Dynamic Regret of Policy Optimization in Non-Stationary Environments,N/A,N/A,https://papers.nips.cc/paper_files/paper/2020/file/4b0091f82f50ff7095647fe893580d60-Paper.pdf,2020
Probabilistic Linear Solvers for Machine Learning,N/A,N/A,https://papers.nips.cc/paper_files/paper/2020/file/4afd521d77158e02aed37e2274b90c9c-Paper.pdf,2020
Multipole Graph Neural Operator for Parametric Partial Differential Equations,N/A,N/A,https://papers.nips.cc/paper_files/paper/2020/file/4b21cf96d4cf612f239a6c322b10c8fe-Paper.pdf,2020
Online Structured Meta-learning,N/A,N/A,https://papers.nips.cc/paper_files/paper/2020/file/4b86ca48d90bd5f0978afa3a012503a4-Paper.pdf,2020
BlockGAN: Learning 3D Object-aware Scene Representations from Unlabelled Images,N/A,N/A,https://papers.nips.cc/paper_files/paper/2020/file/4b29fa4efe4fb7bc667c7b301b74d52d-Paper.pdf,2020
Towards Interpretable Natural Language Understanding with Explanations as Latent Variables,N/A,N/A,https://papers.nips.cc/paper_files/paper/2020/file/4be2c8f27b8a420492f2d44463933eb6-Paper.pdf,2020
Learning Strategic Network Emergence Games,N/A,N/A,https://papers.nips.cc/paper_files/paper/2020/file/4bb236de7787ceedafdff83bb8ea4710-Paper.pdf,2020
What Makes for Good Views for Contrastive Learning?,N/A,N/A,https://papers.nips.cc/paper_files/paper/2020/file/4c2e5eaae9152079b9e95845750bb9ab-Paper.pdf,2020
Barking up the right tree: an approach to search over molecule synthesis DAGs,N/A,N/A,https://papers.nips.cc/paper_files/paper/2020/file/4cc05b35c2f937c5bd9e7d41d3686fff-Paper.pdf,2020
The Mean-Squared Error of Double Q-Learning,N/A,N/A,https://papers.nips.cc/paper_files/paper/2020/file/4bfbd52f4e8466dc12aaf30b7e057b66-Paper.pdf,2020
On Uniform Convergence and Low-Norm Interpolation Learning,N/A,N/A,https://papers.nips.cc/paper_files/paper/2020/file/4cc5400e63624c44fadeda99f57588a6-Paper.pdf,2020
Sampling from a k-DPP without looking at all items,N/A,N/A,https://papers.nips.cc/paper_files/paper/2020/file/4d410063822cd9be28f86701c0bc3a31-Paper.pdf,2020
Bandit Samplers for Training Graph Neural Networks,N/A,N/A,https://papers.nips.cc/paper_files/paper/2020/file/4cea2358d3cc5f8cd32397ca9bc51b94-Paper.pdf,2020
A Dictionary Approach to Domain-Invariant Learning in Deep Networks,N/A,N/A,https://papers.nips.cc/paper_files/paper/2020/file/490640b43519c77281cb2f8471e61a71-Paper.pdf,2020
Evaluating and Rewarding Teamwork Using Cooperative Game Abstractions,N/A,N/A,https://papers.nips.cc/paper_files/paper/2020/file/4d95d05a4fc4eadbc3b9dde67afdca39-Paper.pdf,2020
Uncovering the Topology of Time-Varying fMRI Data using Cubical Persistence,N/A,N/A,https://papers.nips.cc/paper_files/paper/2020/file/4d771504ddcd28037b4199740df767e6-Paper.pdf,2020
Profile Entropy: A Fundamental Measure for the Learnability and Compressibility of Distributions,N/A,N/A,https://papers.nips.cc/paper_files/paper/2020/file/4dbf29d90d5780cab50897fb955e4373-Paper.pdf,2020
Exchangeable Neural ODE for Set Modeling,N/A,N/A,https://papers.nips.cc/paper_files/paper/2020/file/4db73860ecb5533b5a6c710341d5bbec-Paper.pdf,2020
Hierarchical Poset Decoding for Compositional Generalization in Language,N/A,N/A,https://papers.nips.cc/paper_files/paper/2020/file/4d7e0d72898ae7ea3593eb5ebf20c744-Paper.pdf,2020
"Regularized linear autoencoders recover the principal components, eventually",N/A,N/A,https://papers.nips.cc/paper_files/paper/2020/file/4dd9cec1c21bc54eecb53786a2c5fa09-Paper.pdf,2020
CoADNet: Collaborative Aggregation-and-Distribution Networks for Co-Salient Object Detection,N/A,N/A,https://papers.nips.cc/paper_files/paper/2020/file/4dc3ed26a29c9c3df3ec373524377a5b-Paper.pdf,2020
Semi-Supervised Partial Label Learning via Confidence-Rated Margin Maximization,N/A,N/A,https://papers.nips.cc/paper_files/paper/2020/file/4dea382d82666332fb564f2e711cbc71-Paper.pdf,2020
Learning Restricted Boltzmann Machines with Sparse Latent Variables,N/A,N/A,https://papers.nips.cc/paper_files/paper/2020/file/4e668929edb3bf915e1a3a9d96c3c97e-Paper.pdf,2020
Sample Complexity of Asynchronous Q-Learning: Sharper Analysis and Variance Reduction,N/A,N/A,https://papers.nips.cc/paper_files/paper/2020/file/4eab60e55fe4c7dd567a0be28016bff3-Paper.pdf,2020
Curriculum learning for multilevel budgeted combinatorial problems,N/A,N/A,https://papers.nips.cc/paper_files/paper/2020/file/4eb7d41ae6005f60fe401e56277ebd4e-Paper.pdf,2020
Wavelet Flow: Fast Training of High Resolution Normalizing Flows,N/A,N/A,https://papers.nips.cc/paper_files/paper/2020/file/4491777b1aa8b5b32c2e8666dbe1a495-Paper.pdf,2020
FedSplit: an algorithmic framework for fast federated optimization,N/A,N/A,https://papers.nips.cc/paper_files/paper/2020/file/4ebd440d99504722d80de606ea8507da-Paper.pdf,2020
Estimation and Imputation in Probabilistic Principal Component Analysis with Missing Not At Random Data,N/A,N/A,https://papers.nips.cc/paper_files/paper/2020/file/4ecb679fd35dcfd0f0894c399590be1a-Paper.pdf,2020
Neuronal Gaussian Process Regression,N/A,N/A,https://papers.nips.cc/paper_files/paper/2020/file/4ef2f8259495563cb3a8ea4449ec4f9f-Paper.pdf,2020
Nonconvex Sparse Graph Learning under Laplacian Constrained Graphical Model,N/A,N/A,https://papers.nips.cc/paper_files/paper/2020/file/4ef42b32bccc9485b10b8183507e5d82-Paper.pdf,2020
Synthetic Data Generators -- Sequential and Private,N/A,N/A,https://papers.nips.cc/paper_files/paper/2020/file/4eff0720836a198b6174eecf02cbfdbf-Paper.pdf,2020
Uncertainty Quantification for Inferring Hawkes Networks,N/A,N/A,https://papers.nips.cc/paper_files/paper/2020/file/4f00921114932db3f8662a41b44ee68f-Paper.pdf,2020
Implicit Distributional Reinforcement Learning,N/A,N/A,https://papers.nips.cc/paper_files/paper/2020/file/4f20f7f5d2e7a1b640ebc8244428558c-Paper.pdf,2020
