title,authors,abstract,pdf_url,year
Make One-Shot Video Object Segmentation Efficient Again,N/A,N/A,https://papers.nips.cc/paper_files/paper/2020/file/781397bc0630d47ab531ea850bddcf63-Paper.pdf,2020
Monotone operator equilibrium networks,N/A,N/A,https://papers.nips.cc/paper_files/paper/2020/file/798d1c2813cbdf8bcdb388db0e32d496-Paper.pdf,2020
Gibbs Sampling with People,N/A,N/A,https://papers.nips.cc/paper_files/paper/2020/file/7880d7226e872b776d8b9f23975e2a3d-Paper.pdf,2020
Constraining Variational Inference with Geometric Jensen-Shannon Divergence,N/A,N/A,https://papers.nips.cc/paper_files/paper/2020/file/78719f11fa2df9917de3110133506521-Paper.pdf,2020
Shared Experience Actor-Critic for Multi-Agent Reinforcement Learning,N/A,N/A,https://papers.nips.cc/paper_files/paper/2020/file/7967cc8e3ab559e68cc944c44b1cf3e8-Paper.pdf,2020
Non-Stochastic Control with Bandit Feedback,N/A,N/A,https://papers.nips.cc/paper_files/paper/2020/file/7a1d9028a78f418cb8f01909a348d9b2-Paper.pdf,2020
Generalized Leverage Score Sampling for Neural Networks,N/A,N/A,https://papers.nips.cc/paper_files/paper/2020/file/7a22c0c0a4515485e31f95fd372050c9-Paper.pdf,2020
An Optimal Elimination Algorithm for Learning a Best Arm,N/A,N/A,https://papers.nips.cc/paper_files/paper/2020/file/7a43ed4e82d06a1e6b2e88518fb8c2b0-Paper.pdf,2020
Efficient Projection-free Algorithms for Saddle Point Problems,N/A,N/A,https://papers.nips.cc/paper_files/paper/2020/file/7a53928fa4dd31e82c6ef826f341daec-Paper.pdf,2020
A mathematical model for automatic differentiation in machine learning,N/A,N/A,https://papers.nips.cc/paper_files/paper/2020/file/7a674153c63cff1ad7f0e261c369ab2c-Paper.pdf,2020
Unsupervised Text Generation by Learning from Search,N/A,N/A,https://papers.nips.cc/paper_files/paper/2020/file/7a677bb4477ae2dd371add568dd19e23-Paper.pdf,2020
Learning Compositional Rules via Neural Program Synthesis,N/A,N/A,https://papers.nips.cc/paper_files/paper/2020/file/7a685d9edd95508471a9d3d6fcace432-Paper.pdf,2020
Incorporating BERT into Parallel Sequence Decoding with Adapters,N/A,N/A,https://papers.nips.cc/paper_files/paper/2020/file/7a6a74cbe87bc60030a4bd041dd47b78-Paper.pdf,2020
When and How to Lift the Lockdown? Global COVID-19 Scenario Analysis and Policy Assessment using Compartmental Gaussian Processes,N/A,N/A,https://papers.nips.cc/paper_files/paper/2020/file/79a3308b13cd31f096d8a4a34f96b66b-Paper.pdf,2020
Unsupervised Learning of Lagrangian Dynamics from Images for Prediction and Control,N/A,N/A,https://papers.nips.cc/paper_files/paper/2020/file/79f56e5e3e0e999b3c139f225838d41f-Paper.pdf,2020
"SURF: A Simple, Universal, Robust, Fast Distribution Learning Algorithm",N/A,N/A,https://papers.nips.cc/paper_files/paper/2020/file/7ac52e3f2729d1b3f6d2b7e8f6467226-Paper.pdf,2020
Understanding Approximate Fisher Information for Fast Convergence of Natural Gradient Descent in Wide Neural Networks,N/A,N/A,https://papers.nips.cc/paper_files/paper/2020/file/7b41bfa5085806dfa24b8c9de0ce567f-Paper.pdf,2020
Stable and expressive recurrent vision models,N/A,N/A,https://papers.nips.cc/paper_files/paper/2020/file/766d856ef1a6b02f93d894415e6bfa0e-Paper.pdf,2020
General Transportability of Soft Interventions: Completeness Results,N/A,N/A,https://papers.nips.cc/paper_files/paper/2020/file/7b497aa1b2a83ec63d1777a88676b0c2-Paper.pdf,2020
Estimating Fluctuations in Neural Representations of Uncertain Environments,N/A,N/A,https://papers.nips.cc/paper_files/paper/2020/file/7a8b8402b2f0fc78cf726ee484a0a2b7-Paper.pdf,2020
SCOP: Scientific Control for Reliable Neural Network Pruning,N/A,N/A,https://papers.nips.cc/paper_files/paper/2020/file/7bcdf75ad237b8e02e301f4091fb6bc8-Paper.pdf,2020
Provably Consistent Partial-Label Learning,N/A,N/A,https://papers.nips.cc/paper_files/paper/2020/file/7bd28f15a49d5e5848d6ec70e584e625-Paper.pdf,2020
Lipschitz Bounds and Provably Robust Training by Laplacian Smoothing,N/A,N/A,https://papers.nips.cc/paper_files/paper/2020/file/7bab7650be60b0738e22c3b8745f937d-Paper.pdf,2020
"Robust, Accurate Stochastic Optimization for Variational Inference",N/A,N/A,https://papers.nips.cc/paper_files/paper/2020/file/7cac11e2f46ed46c339ec3d569853759-Paper.pdf,2020
Discovering conflicting groups in signed networks,N/A,N/A,https://papers.nips.cc/paper_files/paper/2020/file/7cc538b1337957dae283c30ad46def38-Paper.pdf,2020
Learning Some Popular Gaussian Graphical Models without Condition Number Bounds,N/A,N/A,https://papers.nips.cc/paper_files/paper/2020/file/7cc980b0f894bd0cf05c37c246f215f3-Paper.pdf,2020
Sense and Sensitivity Analysis: Simple Post-Hoc Analysis of Bias Due to Unobserved Confounding,N/A,N/A,https://papers.nips.cc/paper_files/paper/2020/file/7d265aa7147bd3913fb84c7963a209d1-Paper.pdf,2020
GAIT-prop: A biologically plausible learning rule derived from backpropagation of error,N/A,N/A,https://papers.nips.cc/paper_files/paper/2020/file/7ba0691b7777b6581397456412a41390-Paper.pdf,2020
Mix and Match: An Optimistic Tree-Search Approach for Learning Models from Mixture Distributions,N/A,N/A,https://papers.nips.cc/paper_files/paper/2020/file/7d3d5bcad324d3edc08e40738e663554-Paper.pdf,2020
Understanding Double Descent Requires A Fine-Grained Bias-Variance Decomposition,N/A,N/A,https://papers.nips.cc/paper_files/paper/2020/file/7d420e2b2939762031eed0447a9be19f-Paper.pdf,2020
The Smoothed Possibility of Social Choice,N/A,N/A,https://papers.nips.cc/paper_files/paper/2020/file/7e05d6f828574fbc975a896b25bb011e-Paper.pdf,2020
"Discover, Hallucinate, and Adapt: Open Compound Domain Adaptation for Semantic Segmentation",N/A,N/A,https://papers.nips.cc/paper_files/paper/2020/file/7a9a322cbe0d06a98667fdc5160dc6f8-Paper.pdf,2020
VIME: Extending the Success of Self- and Semi-supervised Learning to Tabular Domain,N/A,N/A,https://papers.nips.cc/paper_files/paper/2020/file/7d97667a3e056acab9aaf653807b4a03-Paper.pdf,2020
A Decentralized Parallel Algorithm for Training Generative Adversarial Nets,N/A,N/A,https://papers.nips.cc/paper_files/paper/2020/file/7e0a0209b929d097bd3e8ef30567a5c1-Paper.pdf,2020
Hybrid Variance-Reduced SGD Algorithms For Minimax Problems with Nonconvex-Linear Function,N/A,N/A,https://papers.nips.cc/paper_files/paper/2020/file/7f141cf8e7136ce8701dc6636c2a6fe4-Paper.pdf,2020
Phase retrieval in high dimensions: Statistical and computational phase transitions,N/A,N/A,https://papers.nips.cc/paper_files/paper/2020/file/7ec0dbeee45813422897e04ad8424a5e-Paper.pdf,2020
Belief-Dependent Macro-Action Discovery in POMDPs using the Value of Information,N/A,N/A,https://papers.nips.cc/paper_files/paper/2020/file/7f2be1b45d278ac18804b79207a24c53-Paper.pdf,2020
Fair Performance Metric Elicitation,N/A,N/A,https://papers.nips.cc/paper_files/paper/2020/file/7ec2442aa04c157590b2fa1a7d093a33-Paper.pdf,2020
LoCo: Local Contrastive Representation Learning,N/A,N/A,https://papers.nips.cc/paper_files/paper/2020/file/7fa215c9efebb3811a7ef58409907899-Paper.pdf,2020
Modeling and Optimization Trade-off in Meta-learning,N/A,N/A,https://papers.nips.cc/paper_files/paper/2020/file/7fc63ff01769c4fa7d9279e97e307829-Paper.pdf,2020
SnapBoost: A Heterogeneous Boosting Machine,N/A,N/A,https://papers.nips.cc/paper_files/paper/2020/file/7fd3b80fb1884e2927df46a7139bb8bf-Paper.pdf,2020
On Adaptive Distance Estimation,N/A,N/A,https://papers.nips.cc/paper_files/paper/2020/file/803ef56843860e4a48fc4cdb3065e8ce-Paper.pdf,2020
Stage-wise Conservative Linear Bandits,N/A,N/A,https://papers.nips.cc/paper_files/paper/2020/file/804741413d7fe0e515b19a7ffc7b3027-Paper.pdf,2020
Metric-Free Individual Fairness in Online Learning,N/A,N/A,https://papers.nips.cc/paper_files/paper/2020/file/80b618ebcac7aa97a6dac2ba65cb7e36-Paper.pdf,2020
Fine-Grained Dynamic Head for Object Detection,N/A,N/A,https://papers.nips.cc/paper_files/paper/2020/file/7f6caf1f0ba788cd7953d817724c2b6e-Paper.pdf,2020
GreedyFool: Distortion-Aware Sparse Adversarial Attack,N/A,N/A,https://papers.nips.cc/paper_files/paper/2020/file/8169e05e2a0debcb15458f2cc1eff0ea-Paper.pdf,2020
RELATE: Physically Plausible Multi-Object Scene Synthesis Using Structured Latent Spaces,N/A,N/A,https://papers.nips.cc/paper_files/paper/2020/file/806beafe154032a5b818e97b4420ad98-Paper.pdf,2020
Sample-Efficient Optimization in the Latent Space of Deep Generative Models via Weighted Retraining,N/A,N/A,https://papers.nips.cc/paper_files/paper/2020/file/81e3225c6ad49623167a4309eb4b2e75-Paper.pdf,2020
Soft Contrastive Learning for Visual Localization,N/A,N/A,https://papers.nips.cc/paper_files/paper/2020/file/7f2cba89a7116c7c6b0a769572d5fad9-Paper.pdf,2020
RetroXpert: Decompose Retrosynthesis Prediction Like A Chemist,N/A,N/A,https://papers.nips.cc/paper_files/paper/2020/file/819f46e52c25763a55cc642422644317-Paper.pdf,2020
Improved Sample Complexity for Incremental Autonomous Exploration in MDPs,N/A,N/A,https://papers.nips.cc/paper_files/paper/2020/file/81e793dc8317a3dbc3534ed3f242c418-Paper.pdf,2020
VAEM: a Deep Generative Model for Heterogeneous Mixed Type Data,N/A,N/A,https://papers.nips.cc/paper_files/paper/2020/file/8171ac2c5544a5cb54ac0f38bf477af4-Paper.pdf,2020
RD$^2$: Reward Decomposition with Representation Decomposition,N/A,N/A,https://papers.nips.cc/paper_files/paper/2020/file/82039d16dce0aab3913b6a7ac73deff7-Paper.pdf,2020
Fairness constraints can help exact inference in structured prediction,N/A,N/A,https://papers.nips.cc/paper_files/paper/2020/file/8248a99e81e752cb9b41da3fc43fbe7f-Paper.pdf,2020
"TinyTL: Reduce Memory, Not Parameters for Efficient On-Device Learning",N/A,N/A,https://papers.nips.cc/paper_files/paper/2020/file/81f7acabd411274fcf65ce2070ed568a-Paper.pdf,2020
Self-paced Contrastive Learning with Hybrid Memory for Domain Adaptive Object Re-ID,N/A,N/A,https://papers.nips.cc/paper_files/paper/2020/file/821fa74b50ba3f7cba1e6c53e8fa6845-Paper.pdf,2020
Smooth And Consistent Probabilistic Regression Trees,N/A,N/A,https://papers.nips.cc/paper_files/paper/2020/file/8289889263db4a40463e3f358bb7c7a1-Paper.pdf,2020
Factorized Neural Processes for Neural Processes: K-Shot Prediction of Neural Responses,N/A,N/A,https://papers.nips.cc/paper_files/paper/2020/file/82e9e7a12665240d13d0b928be28f230-Paper.pdf,2020
Winning the Lottery with Continuous Sparsification,N/A,N/A,https://papers.nips.cc/paper_files/paper/2020/file/83004190b1793d7aa15f8d0d49a13eba-Paper.pdf,2020
Joints in Random Forests,N/A,N/A,https://papers.nips.cc/paper_files/paper/2020/file/8396b14c5dff55d13eea57487bf8ed26-Paper.pdf,2020
Computing Valid p-value for Optimal Changepoint by Selective Inference using Dynamic Programming,N/A,N/A,https://papers.nips.cc/paper_files/paper/2020/file/82b04cd5aa016d979fe048f3ddf0e8d3-Paper.pdf,2020
Compositional Generalization by Learning Analytical Expressions,N/A,N/A,https://papers.nips.cc/paper_files/paper/2020/file/83adc9225e4deb67d7ce42d58fe5157c-Paper.pdf,2020
Adversarial robustness via robust low rank representations,N/A,N/A,https://papers.nips.cc/paper_files/paper/2020/file/837a7924b8c0aa866e41b2721f66135c-Paper.pdf,2020
Instance-based Generalization in Reinforcement Learning,N/A,N/A,https://papers.nips.cc/paper_files/paper/2020/file/82674fc29bc0d9895cee346548c2cb5c-Paper.pdf,2020
An implicit function learning approach for parametric modal regression,N/A,N/A,https://papers.nips.cc/paper_files/paper/2020/file/83eaa6722798a773dd55e8fc7443aa09-Paper.pdf,2020
Coresets for Robust Training of Deep Neural Networks against Noisy Labels,N/A,N/A,https://papers.nips.cc/paper_files/paper/2020/file/8493eeaccb772c0878f99d60a0bd2bb3-Paper.pdf,2020
Adapting to Misspecification in Contextual Bandits,N/A,N/A,https://papers.nips.cc/paper_files/paper/2020/file/84c230a5b1bc3495046ef916957c7238-Paper.pdf,2020
Convergence of Meta-Learning with Task-Specific Adaptation over Partial Parameters,N/A,N/A,https://papers.nips.cc/paper_files/paper/2020/file/84c578f202616448a2f80e6f56d5f16d-Paper.pdf,2020
JAX MD: A Framework for Differentiable Physics,N/A,N/A,https://papers.nips.cc/paper_files/paper/2020/file/83d3d4b6c9579515e1679aca8cbc8033-Paper.pdf,2020
MetaPerturb: Transferable Regularizer for Heterogeneous Tasks and Architectures,N/A,N/A,https://papers.nips.cc/paper_files/paper/2020/file/84ddfb34126fc3a48ee38d7044e87276-Paper.pdf,2020
Learning to solve TV regularised problems with unrolled algorithms,N/A,N/A,https://papers.nips.cc/paper_files/paper/2020/file/84fec9a8e45846340fdf5c7c9f7ed66c-Paper.pdf,2020
Deep Smoothing of the Implied Volatility Surface,N/A,N/A,https://papers.nips.cc/paper_files/paper/2020/file/858e47701162578e5e627cd93ab0938a-Paper.pdf,2020
Object-Centric Learning with Slot Attention,N/A,N/A,https://papers.nips.cc/paper_files/paper/2020/file/8511df98c02ab60aea1b2356c013bc0f-Paper.pdf,2020
Improving robustness against common corruptions by covariate shift adaptation,N/A,N/A,https://papers.nips.cc/paper_files/paper/2020/file/85690f81aadc1749175c187784afc9ee-Paper.pdf,2020
Probabilistic Inference with Algebraic Constraints: Theoretical Limits and Practical Approximations,N/A,N/A,https://papers.nips.cc/paper_files/paper/2020/file/85934679f30131d812a8c7475a7d0f74-Paper.pdf,2020
Provable Online CP/PARAFAC Decomposition of a Structured Tensor via Dictionary Learning,N/A,N/A,https://papers.nips.cc/paper_files/paper/2020/file/85b42dd8aae56e01379be5736db5b496-Paper.pdf,2020
A polynomial-time algorithm for learning nonparametric causal graphs,N/A,N/A,https://papers.nips.cc/paper_files/paper/2020/file/85c9f9efab89cee90a95cb98f15feacd-Paper.pdf,2020
Look-ahead Meta Learning for Continual Learning,N/A,N/A,https://papers.nips.cc/paper_files/paper/2020/file/85b9a5ac91cd629bd3afe396ec07270a-Paper.pdf,2020
SDF-SRN: Learning Signed Distance 3D Object Reconstruction from Static Images,N/A,N/A,https://papers.nips.cc/paper_files/paper/2020/file/83fa5a432ae55c253d0e60dbfa716723-Paper.pdf,2020
Sparse Learning with CART,N/A,N/A,https://papers.nips.cc/paper_files/paper/2020/file/85fc37b18c57097425b52fc7afbb6969-Paper.pdf,2020
Hierarchical Granularity Transfer Learning,N/A,N/A,https://papers.nips.cc/paper_files/paper/2020/file/861637a425ef06e6d539aaaff113d1d5-Paper.pdf,2020
Proximal Mapping for Deep Regularization,N/A,N/A,https://papers.nips.cc/paper_files/paper/2020/file/8606bdb6f1fa707fc6ca309943eea443-Paper.pdf,2020
Deep active inference agents using Monte-Carlo methods,N/A,N/A,https://papers.nips.cc/paper_files/paper/2020/file/865dfbde8a344b44095495f3591f7407-Paper.pdf,2020
Adaptive Learned Bloom Filter (Ada-BF): Efficient Utilization of the Classifier with Application to Real-Time Information Filtering on the Web,N/A,N/A,https://papers.nips.cc/paper_files/paper/2020/file/86b94dae7c6517ec1ac767fd2c136580-Paper.pdf,2020
Manifold structure in graph embeddings,N/A,N/A,https://papers.nips.cc/paper_files/paper/2020/file/8682cc30db9c025ecd3fee433f8ab54c-Paper.pdf,2020
Identifying Causal-Effect Inference Failure with Uncertainty-Aware Models,N/A,N/A,https://papers.nips.cc/paper_files/paper/2020/file/860b37e28ec7ba614f00f9246949561d-Paper.pdf,2020
In search of robust measures of generalization,N/A,N/A,https://papers.nips.cc/paper_files/paper/2020/file/86d7c8a08b4aaa1bc7c599473f5dddda-Paper.pdf,2020
Task-agnostic Exploration in Reinforcement Learning,N/A,N/A,https://papers.nips.cc/paper_files/paper/2020/file/8763d72bba4a7ade23f9ae1f09f4efc7-Paper.pdf,2020
Consistent Estimation of Identifiable Nonparametric Mixture Models from Grouped Observations,N/A,N/A,https://papers.nips.cc/paper_files/paper/2020/file/866d90e0921ac7b024b47d672445a086-Paper.pdf,2020
MCUNet: Tiny Deep Learning on IoT Devices,N/A,N/A,https://papers.nips.cc/paper_files/paper/2020/file/86c51678350f656dcc7f490a43946ee5-Paper.pdf,2020
Provably Efficient Reward-Agnostic Navigation with Linear Value Iteration,N/A,N/A,https://papers.nips.cc/paper_files/paper/2020/file/87736972ed2fb48230f1052699dedbe7-Paper.pdf,2020
Efficient Marginalization of Discrete and Structured Latent Variables via Sparsity,N/A,N/A,https://papers.nips.cc/paper_files/paper/2020/file/887caadc3642e304ede659b734f79b00-Paper.pdf,2020
Distributional Robustness with IPMs and links to Regularization and GANs,N/A,N/A,https://papers.nips.cc/paper_files/paper/2020/file/8929c70f8d710e412d38da624b21c3c8-Paper.pdf,2020
Multi-task Additive Models for Robust Estimation and Automatic Structure Discovery,N/A,N/A,https://papers.nips.cc/paper_files/paper/2020/file/8767bccb1ff4231a9962e3914f4f1f8f-Paper.pdf,2020
Softmax Deep Double Deterministic Policy Gradients,N/A,N/A,https://papers.nips.cc/paper_files/paper/2020/file/884d247c6f65a96a7da4d1105d584ddd-Paper.pdf,2020
A shooting formulation of deep learning,N/A,N/A,https://papers.nips.cc/paper_files/paper/2020/file/89562dccfeb1d0394b9ae7e09544dc70-Paper.pdf,2020
Learning Implicit Credit Assignment for Cooperative Multi-Agent Reinforcement Learning,N/A,N/A,https://papers.nips.cc/paper_files/paper/2020/file/8977ecbb8cb82d77fb091c7a7f186163-Paper.pdf,2020
Online Decision Based Visual Tracking via Reinforcement Learning,N/A,N/A,https://papers.nips.cc/paper_files/paper/2020/file/885b2c7a6deb4fea10f319c4ce993e02-Paper.pdf,2020
"Restless-UCB, an Efficient and Low-complexity Algorithm for Online Restless Bandits",N/A,N/A,https://papers.nips.cc/paper_files/paper/2020/file/89ae0fe22c47d374bc9350ef99e01685-Paper.pdf,2020
MATE: Plugging in Model Awareness to Task Embedding for Meta Learning,N/A,N/A,https://papers.nips.cc/paper_files/paper/2020/file/8989e07fc124e7a9bcbdebcc8ace2bc0-Paper.pdf,2020
CSI: Novelty Detection via Contrastive Learning on Distributionally Shifted Instances,N/A,N/A,https://papers.nips.cc/paper_files/paper/2020/file/8965f76632d7672e7d3cf29c87ecaa0c-Paper.pdf,2020
On the Trade-off between Adversarial and Backdoor Robustness,N/A,N/A,https://papers.nips.cc/paper_files/paper/2020/file/8b4066554730ddfaa0266346bdc1b202-Paper.pdf,2020
High-Fidelity Generative Image Compression,N/A,N/A,https://papers.nips.cc/paper_files/paper/2020/file/8a50bae297807da9e97722a0b3fd8f27-Paper.pdf,2020
Implicit Graph Neural Networks,N/A,N/A,https://papers.nips.cc/paper_files/paper/2020/file/8b5c8441a8ff8e151b191c53c1842a38-Paper.pdf,2020
A Statistical Mechanics Framework for Task-Agnostic Sample Design in Machine Learning,N/A,N/A,https://papers.nips.cc/paper_files/paper/2020/file/8a7129b8f3edd95b7d969dfc2c8e9d9d-Paper.pdf,2020
DeepI2I: Enabling Deep Hierarchical Image-to-Image Translation by Transferring from GANs,N/A,N/A,https://papers.nips.cc/paper_files/paper/2020/file/88855547570f7ff053fff7c54e5148cc-Paper.pdf,2020
Temporal Spike Sequence Learning via Backpropagation for Deep Spiking Neural Networks,N/A,N/A,https://papers.nips.cc/paper_files/paper/2020/file/8bdb5058376143fa358981954e7626b8-Paper.pdf,2020
Guiding Deep Molecular Optimization with Genetic Exploration,N/A,N/A,https://papers.nips.cc/paper_files/paper/2020/file/8ba6c657b03fc7c8dd4dff8e45defcd2-Paper.pdf,2020
Neural Architecture Generator Optimization,N/A,N/A,https://papers.nips.cc/paper_files/paper/2020/file/8c53d30ad023ce50140181f713059ddf-Paper.pdf,2020
A Bandit Learning Algorithm and Applications to Auction Design,N/A,N/A,https://papers.nips.cc/paper_files/paper/2020/file/8ccf1fb8b09a8212bafea305cf5d5e9f-Paper.pdf,2020
Neural Topographic Factor Analysis for fMRI Data,N/A,N/A,https://papers.nips.cc/paper_files/paper/2020/file/8c3c27ac7d298331a1bdfd0a5e8703d3-Paper.pdf,2020
Sample Efficient Reinforcement Learning via Low-Rank Matrix Estimation,N/A,N/A,https://papers.nips.cc/paper_files/paper/2020/file/8d2355364e9a2ba1f82f975414937b43-Paper.pdf,2020
MetaPoison: Practical General-purpose Clean-label Data Poisoning,N/A,N/A,https://papers.nips.cc/paper_files/paper/2020/file/8ce6fc704072e351679ac97d4a985574-Paper.pdf,2020
Deeply Learned Spectral Total Variation Decomposition,N/A,N/A,https://papers.nips.cc/paper_files/paper/2020/file/8d3215ae97598264ad6529613774a038-Paper.pdf,2020
Training Generative Adversarial Networks with Limited Data,N/A,N/A,https://papers.nips.cc/paper_files/paper/2020/file/8d30aa96e72440759f74bd2306c1fa3d-Paper.pdf,2020
TSPNet: Hierarchical Feature Learning via Temporal Semantic Pyramid for Sign Language Translation,N/A,N/A,https://papers.nips.cc/paper_files/paper/2020/file/8c00dee24c9878fea090ed070b44f1ab-Paper.pdf,2020
FracTrain: Fractionally Squeezing Bit Savings Both Temporally and Spatially for Efficient DNN Training,N/A,N/A,https://papers.nips.cc/paper_files/paper/2020/file/8dc5983b8c4ef1d8fcd5f325f9a65511-Paper.pdf,2020
Learning Black-Box Attackers with Transferable Priors and Query Feedback,N/A,N/A,https://papers.nips.cc/paper_files/paper/2020/file/90599c8fdd2f6e7a03ad173e2f535751-Paper.pdf,2020
Minimax Estimation of Conditional Moment Models,N/A,N/A,https://papers.nips.cc/paper_files/paper/2020/file/8fcd9e5482a62a5fa130468f4cf641ef-Paper.pdf,2020
Locally Differentially Private (Contextual) Bandits Learning,N/A,N/A,https://papers.nips.cc/paper_files/paper/2020/file/908c9a564a86426585b29f5335b619bc-Paper.pdf,2020
Invertible Gaussian Reparameterization: Revisiting the Gumbel-Softmax,N/A,N/A,https://papers.nips.cc/paper_files/paper/2020/file/90c34175923a36ab7a5de4b981c1972f-Paper.pdf,2020
Causal Imitation Learning With Unobserved Confounders,N/A,N/A,https://papers.nips.cc/paper_files/paper/2020/file/8fdd149fcaa7058caccc9c4ad5b0d89a-Paper.pdf,2020
Agree to Disagree: Adaptive Ensemble Knowledge Distillation in Gradient Space,N/A,N/A,https://papers.nips.cc/paper_files/paper/2020/file/91c77393975889bd08f301c9e13a44b7-Paper.pdf,2020
The Wasserstein Proximal Gradient Algorithm,N/A,N/A,https://papers.nips.cc/paper_files/paper/2020/file/91cff01af640a24e7f9f7a5ab407889f-Paper.pdf,2020
Universally Quantized Neural Compression,N/A,N/A,https://papers.nips.cc/paper_files/paper/2020/file/92049debbe566ca5782a3045cf300a3c-Paper.pdf,2020
Kernel Based Progressive Distillation for Adder Neural Networks,N/A,N/A,https://papers.nips.cc/paper_files/paper/2020/file/912d2b1c7b2826caf99687388d2e8f7c-Paper.pdf,2020
Temporal Variability in Implicit Online Learning,N/A,N/A,https://papers.nips.cc/paper_files/paper/2020/file/9239be5f9dc4058ec647f14fd04b1290-Paper.pdf,2020
Adversarial Soft Advantage Fitting: Imitation Learning without Policy Optimization,N/A,N/A,https://papers.nips.cc/paper_files/paper/2020/file/9161ab7a1b61012c4c303f10b4c16b2c-Paper.pdf,2020
Escaping Saddle-Point Faster under Interpolation-like Conditions,N/A,N/A,https://papers.nips.cc/paper_files/paper/2020/file/92a08bf918f44ccd961477be30023da1-Paper.pdf,2020
Off-Policy Imitation Learning from Observations,N/A,N/A,https://papers.nips.cc/paper_files/paper/2020/file/92977ae4d2ba21425a59afb269c2a14e-Paper.pdf,2020
Matérn Gaussian Processes on Riemannian Manifolds,N/A,N/A,https://papers.nips.cc/paper_files/paper/2020/file/92bf5e6240737e0326ea59846a83e076-Paper.pdf,2020
"Instead of Rewriting Foreign Code for Machine Learning, Automatically Synthesize Fast Gradients",N/A,N/A,https://papers.nips.cc/paper_files/paper/2020/file/9332c513ef44b682e9347822c2e457ac-Paper.pdf,2020
wav2vec 2.0: A Framework for Self-Supervised Learning of Speech Representations,N/A,N/A,https://papers.nips.cc/paper_files/paper/2020/file/92d1e1eb1cd6f9fba3227870bb6d7f07-Paper.pdf,2020
A Maximum-Entropy Approach to Off-Policy Evaluation in Average-Reward MDPs,N/A,N/A,https://papers.nips.cc/paper_files/paper/2020/file/9308b0d6e5898366a4a986bc33f3d3e7-Paper.pdf,2020
Investigating Gender Bias in Language Models Using Causal Mediation Analysis,N/A,N/A,https://papers.nips.cc/paper_files/paper/2020/file/92650b2e92217715fe312e6fa7b90d82-Paper.pdf,2020
Does Unsupervised Architecture Representation Learning Help Neural Architecture Search?,N/A,N/A,https://papers.nips.cc/paper_files/paper/2020/file/937936029af671cf479fa893db91cbdd-Paper.pdf,2020
Dynamic Regret of Convex and Smooth Functions,N/A,N/A,https://papers.nips.cc/paper_files/paper/2020/file/939314105ce8701e67489642ef4d49e8-Paper.pdf,2020
Value-driven Hindsight Modelling,N/A,N/A,https://papers.nips.cc/paper_files/paper/2020/file/9381fc93ad66f9ec4b2eef71147a6665-Paper.pdf,2020
Improved Techniques for Training Score-Based Generative Models,N/A,N/A,https://papers.nips.cc/paper_files/paper/2020/file/92c3b916311a5517d9290576e3ea37ad-Paper.pdf,2020
Mitigating Manipulation in Peer Review via Randomized Reviewer Assignments,N/A,N/A,https://papers.nips.cc/paper_files/paper/2020/file/93fb39474c51b8a82a68413e2a5ae17a-Paper.pdf,2020
On Convergence of Nearest Neighbor Classifiers over Feature Transformations,N/A,N/A,https://papers.nips.cc/paper_files/paper/2020/file/93d9033636450402d67cd55e60b3f926-Paper.pdf,2020
Contrastive learning of global and local features for medical image segmentation with limited annotations,N/A,N/A,https://papers.nips.cc/paper_files/paper/2020/file/949686ecef4ee20a62d16b4a2d7ccca3-Paper.pdf,2020
Self-Supervised Graph Transformer on Large-Scale Molecular Data,N/A,N/A,https://papers.nips.cc/paper_files/paper/2020/file/94aef38441efa3380a3bed3faf1f9d5d-Paper.pdf,2020
CSER: Communication-efficient SGD with Error Reset,N/A,N/A,https://papers.nips.cc/paper_files/paper/2020/file/94cb02feb750f20bad8a85dfe7e18d11-Paper.pdf,2020
How many samples is a good initial point worth in Low-rank Matrix Recovery?,N/A,N/A,https://papers.nips.cc/paper_files/paper/2020/file/94c4dd41f9dddce696557d3717d98d82-Paper.pdf,2020
Joint Contrastive Learning with Infinite Possibilities,N/A,N/A,https://papers.nips.cc/paper_files/paper/2020/file/9523147e5a6707baf674941812ee5c94-Paper.pdf,2020
Efficient estimation of neural tuning during naturalistic behavior,N/A,N/A,https://papers.nips.cc/paper_files/paper/2020/file/94d2a3c6dd19337f2511cdf8b4bf907e-Paper.pdf,2020
Adversarially-learned Inference via an Ensemble of Discrete Undirected Graphical Models,N/A,N/A,https://papers.nips.cc/paper_files/paper/2020/file/95424358822e753eb993c97ee76a9076-Paper.pdf,2020
