title,authors,abstract,pdf_url,year
Wisdom of the Crowd Voting: Truthful Aggregation of Voter Information and Preferences,N/A,N/A,https://papers.nips.cc/paper_files/paper/2021/file/0e900ad84f63618452210ab8baae0218-Paper.pdf,2021
Replay-Guided Adversarial Environment Design,N/A,N/A,https://papers.nips.cc/paper_files/paper/2021/file/0e915db6326b6fb6a3c56546980a8c93-Paper.pdf,2021
There Is No Turning Back: A Self-Supervised Approach for Reversibility-Aware Reinforcement Learning,N/A,N/A,https://papers.nips.cc/paper_files/paper/2021/file/0e98aeeb54acf612b9eb4e48a269814c-Paper.pdf,2021
Learning to Execute: Efficient Learning of Universal Plan-Conditioned Policies in Robotics,N/A,N/A,https://papers.nips.cc/paper_files/paper/2021/file/0e9b734aa25ca8096cb7b56dc0dd8929-Paper.pdf,2021
Self-Diagnosing GAN: Diagnosing Underrepresented Samples in Generative Adversarial Networks,N/A,N/A,https://papers.nips.cc/paper_files/paper/2021/file/0ebcc77dc72360d0eb8e9504c78d38bd-Paper.pdf,2021
Efficient Truncated Linear Regression with Unknown Noise Variance,N/A,N/A,https://papers.nips.cc/paper_files/paper/2021/file/0ed8861dc36bee580d100f91283d0559-Paper.pdf,2021
Online Multi-Armed Bandits with Adaptive Inference,N/A,N/A,https://papers.nips.cc/paper_files/paper/2021/file/0ec04cb3912c4f08874dd03716f80df1-Paper.pdf,2021
"Conditionally Parameterized, Discretization-Aware Neural Networks for Mesh-Based Modeling of Physical Systems",N/A,N/A,https://papers.nips.cc/paper_files/paper/2021/file/0cddb7c06f1cd518e1efdc0e20b70c31-Paper.pdf,2021
Breaking the Dilemma of Medical Image-to-image Translation,N/A,N/A,https://papers.nips.cc/paper_files/paper/2021/file/0f2818101a7ac4b96ceeba38de4b934c-Paper.pdf,2021
Temporally Abstract Partial Models,N/A,N/A,https://papers.nips.cc/paper_files/paper/2021/file/0f3d014eead934bbdbacb62a01dc4831-Paper.pdf,2021
Multi-Objective SPIBB: Seldonian Offline Policy Improvement with Safety Constraints in Finite MDPs,N/A,N/A,https://papers.nips.cc/paper_files/paper/2021/file/0f65caf0a7d00afd2b87c028e88fe931-Paper.pdf,2021
INDIGO: GNN-Based Inductive Knowledge Graph Completion Using Pair-Wise Encoding,N/A,N/A,https://papers.nips.cc/paper_files/paper/2021/file/0fd600c953cde8121262e322ef09f70e-Paper.pdf,2021
Is Automated Topic Model Evaluation Broken? The Incoherence of Coherence,N/A,N/A,https://papers.nips.cc/paper_files/paper/2021/file/0f83556a305d789b1d71815e8ea4f4b0-Paper.pdf,2021
TransMatcher: Deep Image Matching Through Transformers for Generalizable Person Re-identification,N/A,N/A,https://papers.nips.cc/paper_files/paper/2021/file/0f49c89d1e7298bb9930789c8ed59d48-Paper.pdf,2021
Do Input Gradients Highlight Discriminative Features?,N/A,N/A,https://papers.nips.cc/paper_files/paper/2021/file/0fe6a94848e5c68a54010b61b3e94b0e-Paper.pdf,2021
Minimizing Polarization and Disagreement in Social Networks via Link Recommendation,N/A,N/A,https://papers.nips.cc/paper_files/paper/2021/file/101951fe7ebe7bd8c77d14f75746b4bc-Paper.pdf,2021
Prototypical Cross-Attention Networks for Multiple Object Tracking and Segmentation,N/A,N/A,https://papers.nips.cc/paper_files/paper/2021/file/093f65e080a295f8076b1c5722a46aa2-Paper.pdf,2021
Improving Conditional Coverage via Orthogonal Quantile Regression,N/A,N/A,https://papers.nips.cc/paper_files/paper/2021/file/1006ff12c465532f8c574aeaa4461b16-Paper.pdf,2021
Optimal Rates for Random Order Online Optimization,N/A,N/A,https://papers.nips.cc/paper_files/paper/2021/file/107030ca685076c0ed5e054e2c3ed940-Paper.pdf,2021
Adversarial Attacks on Black Box Video Classifiers: Leveraging the Power of Geometric Transformations,N/A,N/A,https://papers.nips.cc/paper_files/paper/2021/file/103303dd56a731e377d01f6a37badae3-Paper.pdf,2021
Discrete-Valued Neural Communication,N/A,N/A,https://papers.nips.cc/paper_files/paper/2021/file/10907813b97e249163587e6246612e21-Paper.pdf,2021
Inverse-Weighted Survival Games,N/A,N/A,https://papers.nips.cc/paper_files/paper/2021/file/10fb6cfa4c990d2bad5ddef4f70e8ba2-Paper.pdf,2021
Generalization Bounds for Meta-Learning via PAC-Bayes and Uniform Stability,N/A,N/A,https://papers.nips.cc/paper_files/paper/2021/file/1102a326d5f7c9e04fc3c89d0ede88c9-Paper.pdf,2021
Multi-view Contrastive Graph Clustering,N/A,N/A,https://papers.nips.cc/paper_files/paper/2021/file/10c66082c124f8afe3df4886f5e516e0-Paper.pdf,2021
Parallel Bayesian Optimization of Multiple Noisy Objectives with Expected Hypervolume Improvement,N/A,N/A,https://papers.nips.cc/paper_files/paper/2021/file/11704817e347269b7254e744b5e22dac-Paper.pdf,2021
Evolution Gym: A Large-Scale Benchmark for Evolving Soft Robots,N/A,N/A,https://papers.nips.cc/paper_files/paper/2021/file/118921efba23fc329e6560b27861f0c2-Paper.pdf,2021
"Skyformer: Remodel Self-Attention with Gaussian Kernel and Nystr\""om Method",N/A,N/A,https://papers.nips.cc/paper_files/paper/2021/file/10a7cdd970fe135cf4f7bb55c0e3b59f-Paper.pdf,2021
On Calibration and Out-of-Domain Generalization,N/A,N/A,https://papers.nips.cc/paper_files/paper/2021/file/118bd558033a1016fcc82560c65cca5f-Paper.pdf,2021
On the Convergence and Sample Efficiency of Variance-Reduced Policy Gradient Method,N/A,N/A,https://papers.nips.cc/paper_files/paper/2021/file/11c484ea9305ea4c7bb6b2e6d570d466-Paper.pdf,2021
Circa: Stochastic ReLUs for Private Deep Learning,N/A,N/A,https://papers.nips.cc/paper_files/paper/2021/file/11eba2991cc62daa4a85be5c0cfdae97-Paper.pdf,2021
Reinforcement Learning in Reward-Mixing MDPs,N/A,N/A,https://papers.nips.cc/paper_files/paper/2021/file/11f9e78e4899a78dedd439fc583b6693-Paper.pdf,2021
A Gang of Adversarial Bandits,N/A,N/A,https://papers.nips.cc/paper_files/paper/2021/file/124461dcd3571e6674ec4e0e140cc298-Paper.pdf,2021
Robustifying Algorithms of Learning Latent Trees with Vector Variables,N/A,N/A,https://papers.nips.cc/paper_files/paper/2021/file/12e086066892a311b752673a28583d3f-Paper.pdf,2021
Continuous-time edge modelling using non-parametric point processes,N/A,N/A,https://papers.nips.cc/paper_files/paper/2021/file/1301962d8b7bd03fffaa27119aa7fc2b-Paper.pdf,2021
Explaining Hyperparameter Optimization via Partial Dependence Plots,N/A,N/A,https://papers.nips.cc/paper_files/paper/2021/file/12ced2db6f0193dda91ba86224ea1cd8-Paper.pdf,2021
Representation Learning on Spatial Networks,N/A,N/A,https://papers.nips.cc/paper_files/paper/2021/file/12e35d9186dd72fe62fd039385890b9c-Paper.pdf,2021
Solving Min-Max Optimization with Hidden Structure via Gradient Descent Ascent,N/A,N/A,https://papers.nips.cc/paper_files/paper/2021/file/13bf4a96378f3854bcd9792d132eff9f-Paper.pdf,2021
Memory-efficient Patch-based Inference for Tiny Deep Learning,N/A,N/A,https://papers.nips.cc/paper_files/paper/2021/file/1371bccec2447b5aa6d96d2a540fb401-Paper.pdf,2021
TransMIL: Transformer based Correlated Multiple Instance Learning for Whole Slide Image Classification,N/A,N/A,https://papers.nips.cc/paper_files/paper/2021/file/10c272d06794d3e5785d5e7c5356e9ff-Paper.pdf,2021
Preserved central model for faster bidirectional compression in distributed settings,N/A,N/A,https://papers.nips.cc/paper_files/paper/2021/file/13d63838ef1fb6f34ca2dc6821c60e49-Paper.pdf,2021
Understanding Instance-based Interpretability of Variational Auto-Encoders,N/A,N/A,https://papers.nips.cc/paper_files/paper/2021/file/13d7dc096493e1f77fb4ccf3eaf79df1-Paper.pdf,2021
Test-Time Classifier Adjustment Module for Model-Agnostic Domain Generalization,N/A,N/A,https://papers.nips.cc/paper_files/paper/2021/file/1415fe9fea0fa1e45dddcff5682239a0-Paper.pdf,2021
Luna: Linear Unified Nested Attention,N/A,N/A,https://papers.nips.cc/paper_files/paper/2021/file/14319d9cfc6123106878dc20b94fbaf3-Paper.pdf,2021
Iterative Causal Discovery in the Possible Presence of Latent Confounders and Selection Bias,N/A,N/A,https://papers.nips.cc/paper_files/paper/2021/file/144a3f71a03ab7c4f46f9656608efdb2-Paper.pdf,2021
A Bayesian-Symbolic Approach to Reasoning and Learning in Intuitive Physics,N/A,N/A,https://papers.nips.cc/paper_files/paper/2021/file/147540e129e096fa91700e9db6588354-Paper.pdf,2021
Self-Interpretable Model with Transformation Equivariant Interpretation,N/A,N/A,https://papers.nips.cc/paper_files/paper/2021/file/1387a00f03b4b423e63127b08c261bdc-Paper.pdf,2021
Deep inference of latent dynamics with spatio-temporal super-resolution using selective backpropagation through time,N/A,N/A,https://papers.nips.cc/paper_files/paper/2021/file/1325cdae3b6f0f91a1b629307bf2d498-Paper.pdf,2021
Associating Objects with Transformers for Video Object Segmentation,N/A,N/A,https://papers.nips.cc/paper_files/paper/2021/file/147702db07145348245dc5a2f2fe5683-Paper.pdf,2021
Zero Time Waste: Recycling Predictions in Early Exit Neural Networks,N/A,N/A,https://papers.nips.cc/paper_files/paper/2021/file/149ef6419512be56a93169cd5e6fa8fd-Paper.pdf,2021
Voxel-based 3D Detection and Reconstruction of Multiple Objects from a Single Image,N/A,N/A,https://papers.nips.cc/paper_files/paper/2021/file/1415db70fe9ddb119e23e9b2808cde38-Paper.pdf,2021
Automatic Symmetry Discovery with Lie Algebra Convolutional Network,N/A,N/A,https://papers.nips.cc/paper_files/paper/2021/file/148148d62be67e0916a833931bd32b26-Paper.pdf,2021
ReSSL: Relational Self-Supervised Learning with Weak Augmentation,N/A,N/A,https://papers.nips.cc/paper_files/paper/2021/file/14c4f36143b4b09cbc320d7c95a50ee7-Paper.pdf,2021
Hindsight Task Relabelling: Experience Replay for Sparse Reward Meta-RL,N/A,N/A,https://papers.nips.cc/paper_files/paper/2021/file/1454ca2270599546dfcd2a3700e4d2f1-Paper.pdf,2021
Explicit loss asymptotics in the gradient descent training of neural networks,N/A,N/A,https://papers.nips.cc/paper_files/paper/2021/file/14faf969228fc18fcd4fcf59437b0c97-Paper.pdf,2021
Test-Time Personalization with a Transformer for Human Pose Estimation,N/A,N/A,https://papers.nips.cc/paper_files/paper/2021/file/1517c8664be296f0d87d9e5fc54fdd60-Paper.pdf,2021
On Model Calibration for Long-Tailed Object Detection and Instance Segmentation,N/A,N/A,https://papers.nips.cc/paper_files/paper/2021/file/14ad095ecc1c3e1b87f3c522836e9158-Paper.pdf,2021
Weisfeiler and Lehman Go Cellular: CW Networks,N/A,N/A,https://papers.nips.cc/paper_files/paper/2021/file/157792e4abb490f99dbd738483e0d2d4-Paper.pdf,2021
Bias Out-of-the-Box: An Empirical Analysis of Intersectional Occupational Biases in Popular Generative Language Models,N/A,N/A,https://papers.nips.cc/paper_files/paper/2021/file/1531beb762df4029513ebf9295e0d34f-Paper.pdf,2021
Learning Conjoint Attentions for Graph Neural Nets,N/A,N/A,https://papers.nips.cc/paper_files/paper/2021/file/1587965fb4d4b5afe8428a4a024feb0d-Paper.pdf,2021
Towards Scalable Unpaired Virtual Try-On via Patch-Routed Spatially-Adaptive GAN,N/A,N/A,https://papers.nips.cc/paper_files/paper/2021/file/151de84cca69258b17375e2f44239191-Paper.pdf,2021
Hybrid Regret Bounds for Combinatorial Semi-Bandits and Adversarial Linear Bandits,N/A,N/A,https://papers.nips.cc/paper_files/paper/2021/file/15a50c8ba6a0002a2fa7e5d8c0a40bd9-Paper.pdf,2021
Pay Better Attention to Attention: Head Selection in Multilingual and Multi-Domain Sequence Modeling,N/A,N/A,https://papers.nips.cc/paper_files/paper/2021/file/15c00b5250ddedaabc203b67f8b034fd-Paper.pdf,2021
Cardinality-Regularized Hawkes-Granger Model,N/A,N/A,https://papers.nips.cc/paper_files/paper/2021/file/15cf76466b97264765356fcc56d801d1-Paper.pdf,2021
Constrained Robust Submodular Partitioning,N/A,N/A,https://papers.nips.cc/paper_files/paper/2021/file/161882dd2d19c716819081aee2c08b98-Paper.pdf,2021
Online Knapsack with Frequency Predictions,N/A,N/A,https://papers.nips.cc/paper_files/paper/2021/file/161c5c5ad51fcc884157890511b3c8b0-Paper.pdf,2021
Why Lottery Ticket Wins? A Theoretical Perspective of Sample Complexity on Sparse Neural Networks,N/A,N/A,https://papers.nips.cc/paper_files/paper/2021/file/15f99f2165aa8c86c9dface16fefd281-Paper.pdf,2021
Non-convex Distributionally Robust Optimization: Non-asymptotic Analysis,N/A,N/A,https://papers.nips.cc/paper_files/paper/2021/file/164bf317ea19ccfd9e97853edc2389f4-Paper.pdf,2021
Lip to Speech Synthesis with Visual Context Attentional GAN,N/A,N/A,https://papers.nips.cc/paper_files/paper/2021/file/16437d40c29a1a7b1e78143c9c38f289-Paper.pdf,2021
Aligned Structured Sparsity Learning for Efficient Image Super-Resolution,N/A,N/A,https://papers.nips.cc/paper_files/paper/2021/file/15de21c670ae7c3f6f3f1f37029303c9-Paper.pdf,2021
On Component Interactions in Two-Stage Recommender Systems,N/A,N/A,https://papers.nips.cc/paper_files/paper/2021/file/162d18156abe38a3b32851b72b1d44f5-Paper.pdf,2021
Learning to See by Looking at Noise,N/A,N/A,https://papers.nips.cc/paper_files/paper/2021/file/14f2ebeab937ca128186e7ba876faef9-Paper.pdf,2021
Distributed Principal Component Analysis with Limited Communication,N/A,N/A,https://papers.nips.cc/paper_files/paper/2021/file/1680e9fa7b4dd5d62ece800239bb53bd-Paper.pdf,2021
Newton-LESS: Sparsification without Trade-offs for the Sketched Newton Update,N/A,N/A,https://papers.nips.cc/paper_files/paper/2021/file/16837163fee34175358a47e0b51485ff-Paper.pdf,2021
Confident Anchor-Induced Multi-Source Free Domain Adaptation,N/A,N/A,https://papers.nips.cc/paper_files/paper/2021/file/168908dd3227b8358eababa07fcaf091-Paper.pdf,2021
Smooth Normalizing Flows,N/A,N/A,https://papers.nips.cc/paper_files/paper/2021/file/167434fa6219316417cd4160c0c5e7d2-Paper.pdf,2021
Word2Fun: Modelling Words as Functions for Diachronic Word Representation,N/A,N/A,https://papers.nips.cc/paper_files/paper/2021/file/16a5cdae362b8d27a1d8f8c7b78b4330-Paper.pdf,2021
Iteratively Reweighted Least Squares for Basis Pursuit with Global Linear Convergence Rate,N/A,N/A,https://papers.nips.cc/paper_files/paper/2021/file/16bda725ae44af3bb9316f416bd13b1b-Paper.pdf,2021
Low-Rank Constraints for Fast Inference in Structured Models,N/A,N/A,https://papers.nips.cc/paper_files/paper/2021/file/16c0d78ef6a76b5c247113a4c9514059-Paper.pdf,2021
Accumulative Poisoning Attacks on Real-time Data,N/A,N/A,https://papers.nips.cc/paper_files/paper/2021/file/16d11e9595188dbad0418a85f0351aba-Paper.pdf,2021
Estimating the Long-Term Effects of Novel Treatments,N/A,N/A,https://papers.nips.cc/paper_files/paper/2021/file/16fa2b0294e410b2551c3bf6965c0853-Paper.pdf,2021
UCB-based Algorithms for Multinomial Logistic Regression Bandits,N/A,N/A,https://papers.nips.cc/paper_files/paper/2021/file/16f852a6d01b6065c8ff5cc11caae9c6-Paper.pdf,2021
Goal-Aware Cross-Entropy for Multi-Target Reinforcement Learning,N/A,N/A,https://papers.nips.cc/paper_files/paper/2021/file/165a59f7cf3b5c4396ba65953d679f17-Paper.pdf,2021
G-PATE: Scalable Differentially Private Data Generator via Private Aggregation of Teacher Discriminators,N/A,N/A,https://papers.nips.cc/paper_files/paper/2021/file/171ae1bbb81475eb96287dd78565b38b-Paper.pdf,2021
Derivative-Free Policy Optimization for Linear Risk-Sensitive and Robust Control Design: Implicit Regularization and Sample Complexity,N/A,N/A,https://papers.nips.cc/paper_files/paper/2021/file/1714726c817af50457d810aae9d27a2e-Paper.pdf,2021
MetaAvatar: Learning Animatable Clothed Human Models from Few Depth Images,N/A,N/A,https://papers.nips.cc/paper_files/paper/2021/file/1680829293f2a8541efa2647a0290f88-Paper.pdf,2021
On the Existence of The Adversarial Bayes Classifier,N/A,N/A,https://papers.nips.cc/paper_files/paper/2021/file/172ef5a94b4dd0aa120c6878fc29f70c-Paper.pdf,2021
Misspecified Gaussian Process Bandit Optimization,N/A,N/A,https://papers.nips.cc/paper_files/paper/2021/file/177db6acfe388526a4c7bff88e1feb15-Paper.pdf,2021
Convex-Concave Min-Max Stackelberg Games,N/A,N/A,https://papers.nips.cc/paper_files/paper/2021/file/174a61b0b3eab8c94e0a9e78b912307f-Paper.pdf,2021
Dual Progressive Prototype Network for Generalized Zero-Shot Learning,N/A,N/A,https://papers.nips.cc/paper_files/paper/2021/file/1700002963a49da13542e0726b7bb758-Paper.pdf,2021
Object-Aware Regularization for Addressing Causal Confusion in Imitation Learning,N/A,N/A,https://papers.nips.cc/paper_files/paper/2021/file/17a3120e4e5fbdc3cb5b5f946809b06a-Paper.pdf,2021
Multiclass Boosting and the Cost of Weak Learning,N/A,N/A,https://papers.nips.cc/paper_files/paper/2021/file/17f5e6db87929fb55cebeb7fd58c1d41-Paper.pdf,2021
Reliable and Trustworthy Machine Learning for Health Using Dataset Shift Detection,N/A,N/A,https://papers.nips.cc/paper_files/paper/2021/file/17e23e50bedc63b4095e3d8204ce063b-Paper.pdf,2021
Visual Adversarial Imitation Learning using Variational Models,N/A,N/A,https://papers.nips.cc/paper_files/paper/2021/file/1796a48fa1968edd5c5d10d42c7b1813-Paper.pdf,2021
Partition-Based Formulations for Mixed-Integer Optimization of Trained ReLU Neural Networks,N/A,N/A,https://papers.nips.cc/paper_files/paper/2021/file/17f98ddf040204eda0af36a108cbdea4-Paper.pdf,2021
Framing RNN as a kernel method: A neural ODE approach,N/A,N/A,https://papers.nips.cc/paper_files/paper/2021/file/18a9042b3fc5b02fe3d57fea87d6992f-Paper.pdf,2021
3D Pose Transfer with Correspondence Learning and Mesh Refinement,N/A,N/A,https://papers.nips.cc/paper_files/paper/2021/file/18a411989b47ed75a60ac69d9da05aa5-Paper.pdf,2021
"Hyperparameter Optimization Is Deceiving Us, and How to Stop It",N/A,N/A,https://papers.nips.cc/paper_files/paper/2021/file/17fafe5f6ce2f1904eb09d2e80a4cbf6-Paper.pdf,2021
On the Convergence Theory of Debiased Model-Agnostic Meta-Reinforcement Learning,N/A,N/A,https://papers.nips.cc/paper_files/paper/2021/file/18085327b86002fc604c323b9a07f997-Paper.pdf,2021
AutoBalance: Optimized Loss Functions for Imbalanced Data,N/A,N/A,https://papers.nips.cc/paper_files/paper/2021/file/191f8f858acda435ae0daf994e2a72c2-Paper.pdf,2021
Can Information Flows Suggest Targets for Interventions in Neural Circuits?,N/A,N/A,https://papers.nips.cc/paper_files/paper/2021/file/18de4beb01f6a17b6e1dfb9813ba6045-Paper.pdf,2021
Statistical Query Lower Bounds for List-Decodable Linear Regression,N/A,N/A,https://papers.nips.cc/paper_files/paper/2021/file/19b1b73d63d4c9ea79f8ca57e9d67095-Paper.pdf,2021
SyncTwin: Treatment Effect Estimation with Longitudinal Outcomes,N/A,N/A,https://papers.nips.cc/paper_files/paper/2021/file/19485224d128528da1602ca47383f078-Paper.pdf,2021
VigDet: Knowledge Informed Neural Temporal Point Process for Coordination Detection on Social Media,N/A,N/A,https://papers.nips.cc/paper_files/paper/2021/file/1a344877f11195aaf947ccfe48ee9c89-Paper.pdf,2021
An Improved Analysis and Rates for Variance Reduction under Without-replacement Sampling Orders,N/A,N/A,https://papers.nips.cc/paper_files/paper/2021/file/1a3650aedfdd3a21444047ed2d89458f-Paper.pdf,2021
Unsupervised Motion Representation Learning with Capsule Autoencoders,N/A,N/A,https://papers.nips.cc/paper_files/paper/2021/file/19ca14e7ea6328a42e0eb13d585e4c22-Paper.pdf,2021
Exploring Forensic Dental Identification with Deep Learning,N/A,N/A,https://papers.nips.cc/paper_files/paper/2021/file/1a423f7c07a179ec243e82b0c017a034-Paper.pdf,2021
Multi-Agent Reinforcement Learning for Active Voltage Control on Power Distribution Networks,N/A,N/A,https://papers.nips.cc/paper_files/paper/2021/file/1a6727711b84fd1efbb87fc565199d13-Paper.pdf,2021
A Constant Approximation Algorithm for Sequential Random-Order No-Substitution k-Median Clustering,N/A,N/A,https://papers.nips.cc/paper_files/paper/2021/file/1aa057313c28fa4a40c5bc084b11d276-Paper.pdf,2021
Learning Equilibria in Matching Markets from Bandit Feedback,N/A,N/A,https://papers.nips.cc/paper_files/paper/2021/file/1b89a2e980724cb8997459fadb907712-Paper.pdf,2021
Dangers of Bayesian Model Averaging under Covariate Shift,N/A,N/A,https://papers.nips.cc/paper_files/paper/2021/file/1ab60b5e8bd4eac8a7537abb5936aadc-Paper.pdf,2021
Towards Lower Bounds on the Depth of ReLU Neural Networks,N/A,N/A,https://papers.nips.cc/paper_files/paper/2021/file/1b9812b99fe2672af746cefda86be5f9-Paper.pdf,2021
The Limitations of Large Width in Neural Networks: A Deep Gaussian Process Perspective,N/A,N/A,https://papers.nips.cc/paper_files/paper/2021/file/1b9f38268c50805669fd8caf8f3cc84a-Paper.pdf,2021
Exact marginal prior distributions of finite Bayesian neural networks,N/A,N/A,https://papers.nips.cc/paper_files/paper/2021/file/1baff70e2669e8376347efd3a874a341-Paper.pdf,2021
Pooling by Sliced-Wasserstein Embedding,N/A,N/A,https://papers.nips.cc/paper_files/paper/2021/file/1bc2029a8851ad344a8d503930dfd7f7-Paper.pdf,2021
On the Theory of Reinforcement Learning with Once-per-Episode Feedback,N/A,N/A,https://papers.nips.cc/paper_files/paper/2021/file/1bf2efbbe0c49b9f567c2e40f645279a-Paper.pdf,2021
ResNEsts and DenseNEsts: Block-based DNN Models with Improved Representation Guarantees,N/A,N/A,https://papers.nips.cc/paper_files/paper/2021/file/1bf50aaf147b3b0ddd26a820d2ed394d-Paper.pdf,2021
Locally private online change point detection,N/A,N/A,https://papers.nips.cc/paper_files/paper/2021/file/1c1d4df596d01da60385f0bb17a4a9e0-Paper.pdf,2021
Looking Beyond Single Images for Contrastive Semantic Segmentation Learning,N/A,N/A,https://papers.nips.cc/paper_files/paper/2021/file/1a68e5f4ade56ed1d4bf273e55510750-Paper.pdf,2021
Invariance Principle Meets Information Bottleneck for Out-of-Distribution Generalization,N/A,N/A,https://papers.nips.cc/paper_files/paper/2021/file/1c336b8080f82bcc2cd2499b4c57261d-Paper.pdf,2021
Repulsive Deep Ensembles are Bayesian,N/A,N/A,https://papers.nips.cc/paper_files/paper/2021/file/1c63926ebcabda26b5cdb31b5cc91efb-Paper.pdf,2021
BayesIMP: Uncertainty Quantification for Causal Data Fusion,N/A,N/A,https://papers.nips.cc/paper_files/paper/2021/file/1ca5c750a30312d1919ae6a4d636dcc4-Paper.pdf,2021
RMM: Reinforced Memory Management for Class-Incremental Learning,N/A,N/A,https://papers.nips.cc/paper_files/paper/2021/file/1cbcaa5abbb6b70f378a3a03d0c26386-Paper.pdf,2021
Spatiotemporal Joint Filter Decomposition in 3D Convolutional Neural Networks,N/A,N/A,https://papers.nips.cc/paper_files/paper/2021/file/1bb91f73e9d31ea2830a5e73ce3ed328-Paper.pdf,2021
Neural Auto-Curricula in Two-Player Zero-Sum Games,N/A,N/A,https://papers.nips.cc/paper_files/paper/2021/file/1cd73be1e256a7405516501e94e892ac-Paper.pdf,2021
Learning Compact Representations of Neural Networks using DiscriminAtive Masking (DAM),N/A,N/A,https://papers.nips.cc/paper_files/paper/2021/file/1cc8a8ea51cd0adddf5dab504a285915-Paper.pdf,2021
From global to local MDI variable importances for random forests and when they are Shapley values,N/A,N/A,https://papers.nips.cc/paper_files/paper/2021/file/1cfa81af29c6f2d8cacb44921722e753-Paper.pdf,2021
Adversarial Robustness of Streaming Algorithms through Importance Sampling,N/A,N/A,https://papers.nips.cc/paper_files/paper/2021/file/1d01bd2e16f57892f0954902899f0692-Paper.pdf,2021
Learning to Generate Realistic Noisy Images via Pixel-level Noise-aware  Adversarial Training,N/A,N/A,https://papers.nips.cc/paper_files/paper/2021/file/1a5b1e4daae265b790965a275b53ae50-Paper.pdf,2021
On Interaction Between Augmentations and Corruptions in Natural Corruption Robustness,N/A,N/A,https://papers.nips.cc/paper_files/paper/2021/file/1d49780520898fe37f0cd6b41c5311bf-Paper.pdf,2021
Contextual Similarity Aggregation with Self-attention for Visual Re-ranking,N/A,N/A,https://papers.nips.cc/paper_files/paper/2021/file/18d10dc6e666eab6de9215ae5b3d54df-Paper.pdf,2021
Dynamic Distillation Network for Cross-Domain Few-Shot Recognition with Unlabeled Data,N/A,N/A,https://papers.nips.cc/paper_files/paper/2021/file/1d6408264d31d453d556c60fe7d0459e-Paper.pdf,2021
Tractable Regularization of Probabilistic Circuits,N/A,N/A,https://papers.nips.cc/paper_files/paper/2021/file/1d0832c4969f6a4cc8e8a8fffe083efb-Paper.pdf,2021
QuPeD: Quantized Personalization via Distillation with Applications to Federated Learning,N/A,N/A,https://papers.nips.cc/paper_files/paper/2021/file/1dba3025b159cd9354da65e2d0436a31-Paper.pdf,2021
The Out-of-Distribution Problem in Explainability and Search Methods for Feature Importance Explanations,N/A,N/A,https://papers.nips.cc/paper_files/paper/2021/file/1def1713ebf17722cbe300cfc1c88558-Paper.pdf,2021
Model Adaptation: Historical Contrastive Learning for Unsupervised Domain Adaptation without Source Data,N/A,N/A,https://papers.nips.cc/paper_files/paper/2021/file/1dba5eed8838571e1c80af145184e515-Paper.pdf,2021
ImageBART: Bidirectional Context with Multinomial Diffusion for Autoregressive Image Synthesis,N/A,N/A,https://papers.nips.cc/paper_files/paper/2021/file/1cdf14d1e3699d61d237cf76ce1c2dca-Paper.pdf,2021
Hypergraph Propagation and Community Selection for Objects Retrieval,N/A,N/A,https://papers.nips.cc/paper_files/paper/2021/file/1da546f25222c1ee710cf7e2f7a3ff0c-Paper.pdf,2021
Deep learning is adaptive to intrinsic dimensionality of model smoothness in anisotropic Besov space,N/A,N/A,https://papers.nips.cc/paper_files/paper/2021/file/1dacb10f0623c67cb7dbb37587d8b38a-Paper.pdf,2021
Learning Knowledge Graph-based World Models of Textual Environments,N/A,N/A,https://papers.nips.cc/paper_files/paper/2021/file/1e747ddbea997a1b933aaf58a7953c3c-Paper.pdf,2021
Control Variates for Slate Off-Policy Evaluation,N/A,N/A,https://papers.nips.cc/paper_files/paper/2021/file/1e0b802d5c0e1e8434a771ba7ff2c301-Paper.pdf,2021
"Damped Anderson Mixing for Deep Reinforcement Learning: Acceleration, Convergence, and Stabilization",N/A,N/A,https://papers.nips.cc/paper_files/paper/2021/file/1e79596878b2320cac26dd792a6c51c9-Paper.pdf,2021
On Effective Scheduling of Model-based Reinforcement Learning,N/A,N/A,https://papers.nips.cc/paper_files/paper/2021/file/1e4d36177d71bbb3558e43af9577d70e-Paper.pdf,2021
Approximate Decomposable Submodular Function Minimization for Cardinality-Based Components,N/A,N/A,https://papers.nips.cc/paper_files/paper/2021/file/1e8a19426224ca89e83cef47f1e7f53b-Paper.pdf,2021
Two Sides of Meta-Learning Evaluation: In vs. Out of Distribution,N/A,N/A,https://papers.nips.cc/paper_files/paper/2021/file/1e932f24dc0aa4e7a6ac2beec387416d-Paper.pdf,2021
